"text","cmp_code","eu_code"
"Legislate to require councils to switch from a Cabinet system, which concentrates power into the hands of a few councillors, to a Committee system - where all elected councillors make decisions together for the community they represent.","202.1",NA
"Support councils to further democratise their own processes, including introducing more participatory democracy, allowing residents to form panels and assemblies to directly input into council decision making.","202.4",NA
"Introduce participatory budgeting, to enable local citizens to decide how to allocate part of the council budget, through identifying, discussing and prioritising public spending projects, and having real power to decide how money is spent.","202.4",NA
"Support councils to promote waste prevention innovations and to increase recycling.","501",NA
"Give councils new powers and resources to deliver environmental improvements and increase biodiversity,","501",NA
"as well as tackling flooding and coastal erosion locally.","501",NA
"Require councils (and other public bodies) to divest their pension funds away from fossil-fuel-related investments.","501",NA
"We will encourage all private pension funds to do the same.","501",NA
"ELECTED GREENS DELIVERING:",NA,NA
"Action on Affordable Housing",NA,NA
"In 2018 Green councillors on Brighton & Hove Council pushed the controlling Labour group to reduce rents on local council houses, by calculating these rents using local wages - not local house prices.",NA,NA
"The Green campaign succeeded and in September 2018 council houses were for the first time offered to local families at lower rents based on local wages, meaning that a family with an annual income of £20,000 can now afford to live in a new council house in Brighton.",NA,NA
"In the 2019 local elections the Greens won the popular vote in Brighton, winning 19 councillors - just short of Labour’s total of 20. The Green and Labour groups are now working together on the Council on a plan to build 800 new council homes in the city.",NA,NA
"ELECTED GREENS DELIVERING:",NA,NA
"A New Year Bus Service for Residents",NA,NA
"Each and every year, Green Party activists and councillors in Huddersfield operate and a run a free New Year’s Day bus service for residents. Green Cllr Andrew Cooper helped start the voluntary service in 1992, as residents without cars had to rely on expensive taxi journeys to visit relatives at New Year, due to limited local bus services. Twenty seven years on, Cllr Cooper still drives the bus every year!",NA,NA
"Global justice and international aid","H",NA
"As one of the world’s richest countries and being amongst the first to industrialise, the UK has caused more historical climate change emissions than most.","602.1",NA
"We have a moral imperative to right the wrongs of the past, including using our influence and wealth to help alleviate suffering and redress global power imbalances.","602.1",NA
"We want the UK to be a leading force for good in the world,","601.1",NA
"to be the country that brokers peace","106",NA
"and tries to resolve the refugee crisis.","201.2",NA
"Our international policy will focus on co-operation in order to tackle climate chaos,","501",NA
"to secure fairer, more sustainable societies around the world","501",NA
"and encourage fair and peaceful resolutions to conflict.","106",NA
"We will make supporting the United Nations’ Sustainable Development Goals a priority.","107",NA
"We will build bridges not walls and we will empower people in the Global South to control their futures.","107",NA
"The Green Party’s plan for global justice will: Phase in an increase in spending on foreign aid from 0.7% to 1% of our GNI, making us the third highest donor (by Gross National Income) in the world by 2021.","107",NA
"Make the Climate Emergency","501",NA
"and tackling poverty priorities for our international aid budget.","503",NA
"We will phase out payments to richer nations and increase support for the poorest,","503",NA
"to help countries deal with the causes and impacts of the Climate Emergency.","501",NA
"Support will be given on the basis of need, not UK defence and trade considerations.","503",NA
"Ensure that all UK aid is aimed at the poorest, and is locally designed, appropriate and subject to local scrutiny.","503",NA
"Where feasible, aid will be given as grants, not loans.","107",NA
"Making finance and technology available to support developing nations to develop local Green New Deals and transform their economies,","416.2",NA
"equipping them to tackle the causes and impacts of the Climate Emergency.","501",NA
"Increase the proportion of aid paid to individuals through electronic cash transfers, providing regular monthly payments to women in the developing world.","706",NA
"This builds on evidence showing that greater control over household resources by women can result in spending that benefits children and builds economic resilience.","503",NA
"Write off debts owed to the UK by the poorest countries.","107",NA
"Other aid-receiving countries in debt to the UK will have their debt service payments limited to 10% of export earnings per year.","107",NA
"Press other aid-giving nations and international bodies to embed the above principles in their aid programmes, and to abolish ‘tied aid’ (whereby a nation is only given aid in return for buying goods and services from the donor).","107",NA
"Require UK corporations to abide by the environmental, labour and social laws of their own country and of the country in which they are operating - whichever are the more stringent - and advocate for other corporations to do the same.","403",NA
"Ensure just supply chains for the materials necessary for the Green New Deal.","501",NA
"Introduce a new law on Universal Jurisdiction, to make it easier to prosecute those committing genocide, crimes against humanity and war crimes, wherever these crimes take place.","107",NA
"Seek to make the combatting of climate and ecological breakdown","501",NA
"and the spreading of human rights and justice core purposes of the United Nations.","201.2",NA
"Support the introduction of an EU-wide carbon tariff on countries which are not reducing their carbon emissions in line with the Paris Agreement of 2015, to further encourage global action on the Climate Emergency.","501",NA
"Seek resolution in line with international law and the principles of self-determination to long running conflicts, illegal occupations and human rights violations.","107",NA
"Guarantee the rights of indigenous and native people by securing their autonomy, land rights and human rights,","607.3",NA
"providing aid to protect cultures","607.3",NA
"and support sustainable initiatives","416.2",NA
"and ensuring that development schemes where the UK government has influence only take place with the permission, and under the active control of, indigenous people.","607.3",NA
"Champion a treaty which establishes the Arctic, Antarctic and Amazon as World Nature Reserves.","501",NA
"In these new reserves, commercial exploitation of natural resources would be banned","416.2",NA
"and the rights of indigenous populations protected.","607.3",NA
"Create a new international ‘ecocide’ law to prosecute crime against the natural environment.","501",NA
"Commit that any future trade deals will maintain and enhance environmental and food standards","416.2",NA
"and workers’ rights,","701",NA
"minimise the environmental footprint of trade,","501",NA
"make trade terms explicitly subject to environmental and human rights commitments,","416.2",NA
"and not undermine the implementation of existing or new national and international commitments (including over protections for vital global ecosystems and habitats such as the Amazon,","416.2",NA
"and for indigenous people).","607.3",NA
"End the current practice of including investor-state dispute settlement mechanisms in trade and investment agreements.","403",NA
"These mechanisms can give too much power to investors, at the expense of democracy, and need to be scrapped.","202.1",NA
"Ensure trade democracy by assessing the development impact of all trade and investment agreements and guaranteeing Parliament a vote on them.","202.1",NA
"These policies will integrate closely with those set out in the ‘Green New Deal’ chapter of this Manifesto, ensuring that international aid and UK foreign policy help other countries to reduce their carbon emissions and build sustainable economies.","501",NA
"THE GREEN QUALITY OF LIFE GUARANTEE","H",NA
"Unleashing a Revolution in Public Services and the Public Realm","H",NA
"We pay for public services, we use them, we own them.","504",NA
"It’s time they properly belonged to all of us.","504",NA
"From our hospitals to our post offices, energy grid, water, railways and schools, the Green Party will campaign for public services that are run by the people for the people.","504",NA
"These services will be properly resourced to meet your needs, now and in the future, not struggling to keep pace with demand.","504",NA
"Since 2010 the NHS, facing unprecedented rising demand, has been given barely half the resources it needs to keep up.","504",NA
"Schools now have less to spend per pupil than they did in 2010.","506",NA
"The government’s role is to make you feel safer and more secure, but it’s doing the opposite.","504",NA
"Too many people fear not being able to access the basic services they need, and this can sometimes turn into resentment against scapegoats eagerly offered up by hard right politicians, such as migrants and people on benefits.","504",NA
"The Green Party offers something different: a guarantee that our public services will grow and improve.","504",NA
"And we will be honest enough to tell you that this means transforming the tax system so we can afford to invest in quality of life for all.","503",NA
"We will ensure those working in our public services have the resources to deliver services they can be proud of.","504",NA
"We will invest in public services built on the principle of kindness.","504",NA
"We will support new technologies and approaches that will let us live longer, healthier lives.","411",NA
"We will revolutionise the relationship between citizens and the public realm.","606.1",NA
"From access to the countryside to spending more time with loved ones, our quality of life guarantee is all about unleashing the potential for everyone to live happier, more secure lives - and making this the central purpose of government.","503",NA
"A guarantee of a good quality of life is at the very heart of what the Green New Deal will achieve.","503",NA
"Delivering secure incomes and secure homes","H",NA
"Social justice is at the heart of our plans to transform the UK into a more equal country, where everyone can build a decent, secure life.","503",NA
"The Green New Deal set out in the first part of this Manifesto will deliver a Universal Basic Income (UBI), a weekly payment for everyone, replacing the current benefits system and lifting everyone up.","504",NA
"The Green UBI will also: Provide all pensioners with a decent income, recognising their contribution to society over their lifetimes.","504",NA
"All pensioners will receive £178 a week (£10 higher than the current highest possible state pension payment).","504",NA
"This rate will be increased in line with inflation over the years to come.","504",NA
"Be phased in, with a view to all adults being in receipt of their full rate of UBI by 2025.","504",NA
"with the first tranche of people to receive it being women born in the 1950s.","503",NA
"These women, represented by the campaign Group WASPI (Women against State Pension Inequality) have been penalised by unnecessarily abrupt changes to the pension age brought in by the Coalition Government and it is right that are first to feel the benefits of UBI.","503",NA
"We will also look at additional ways of addressing this injustice, which has affected hundreds of thousands of women.","503",NA
"We hope to have fully phased UBI for every UK resident by 2025.","504",NA
"Ensure nobody who takes times off work in order to care for loved ones, or has an irregular employment record, unjustly struggles to access the state pension.","504",NA
"Everyone will receive UBI, at either the adult (£89 per week) or pension (£178 per week) rate.","505",NA
"Provide a supplement to UBI for people with disabilities.","503",NA
"This will help restore the benefits withdrawn from disabled people over the past ten years, providing more financial security.","503",NA
"Continue to pay Housing Benefit to those who received it before UBI was introduced, so that they can cover their rent.","504",NA
"Continue to pay a full Carers Allowance to carers, on top of the UBI payment.","504",NA
"This means that a full-time carer would continue to receive their £3,200 Carers Allowance, plus £4,630 in UBI payments a year.","504",NA
"Replace Universal Credit and the cruel benefit sanctions regime, which have left hundreds of thousands of people facing destitution.","504",NA
"We will also transform the support provided to citizens by: Increasing the Living Wage to £12","412",NA
"and extending it to workers aged between 16 and 21.","412",NA
"Legislating to ensure the maximum wage paid to any member of staff in an organisation should not exceed ten times that paid (pro rata) to the lowest paid worker in the same organisation.","701",NA
"We will also ban any bonuses exceeding the annual wage of the lowest paid worker in the organisation granting the bonus.","701",NA
"Reviewing current employment law to close loopholes that allow employers in the gig economy (where workers are offered freelance work or short-term contracts only) to deny gig workers key rights.","701",NA
"We will ensure that gig economy workers always receive at least the current minimum wage,","701",NA
"and have job security, sick leave, holiday pay and pension provision.","701",NA
"Closing the gender pay gap.","503",NA
"We will require all large and medium size companies to carry out equal pay audits and redress any inequality uncovered both in terms of equal pay for equal work,","503",NA
"and recruitment and retention practices which create a glass ceiling which needs to be shattered.","503",NA
"We will change the law so it’s easier to take action against employers in unequal pay cases.","503",NA
"Installing a 40% quota for women on major company boards.","503",NA
"We recognise the many barriers faced by women and gender non-conforming people in male- dominated spaces,","503",NA
"and know that tackling the ‘boys’ club’ atmosphere in workspaces is crucial to tackling inequality in the workplace.","503",NA
"Provide 35 hours a week of free childcare for all, from the age of nine months.","504",NA
"This free childcare will include in-work facilities, such as on-site creches","701",NA
"and flexible working opportunities (e.g. job¬shares) to help parents who choose to return to work.","701",NA
"Requiring all employers, no matter their size, to legally recognise any union chosen by their workforce to represent them.","701",NA
"Transform the lives of renters, by increasing housing security and bringing rent levels down, especially in places where they currently far outstrip incomes.","504",NA
"We will introduce rent controls on private tenancies, which reflect average local income rates and the cost of maintenance.","403",NA
"We will also end no-fault evictions","403",NA
"and make it easier to set up community-led housing initiatives and for private renters in Houses of Multiple Occupancy to buy and run their home as a housing co-op.","403",NA
"Give communities the first chance to buy local land that comes up for sale by extending Scotland’s Community Right to Buy policy to England and Wales.","403",NA
"Communities will then be able to directly deliver new affordable homes on purchased land, supported by the Community Housing Fund (which the Government plans to end in 2020, but we will maintain for at least another three years).","403",NA
"Creating an environment where everyone feels fulfilled in worthwhile employment","701",NA
"and pursuing policy which will lead to a shorter working week and better work life balance,","701",NA
"freeing up people to spend more time with their loved ones and doing things they love - with no loss of pay.","701",NA
"We will support employers to explore four day working weeks in their workplace, driving up productivity","410",NA
"as well as boosting the wellbeing of staff.","701",NA
"Modernising and reforming copyright and intellectual property rights legislation to ensure a better balance between the rights of consumers and the rights of those working in the creative economy to be protected from commercial exploitation.","403",NA
"ELECTED GREENS DELIVERING",NA,NA
"In February 2019 the Green Group of councillors on Richmond Council proposed a motion to extend payment of the London Living Wage to all council staff, including contractors. The Green councillors built support for the motion and got it through council, securing a pay rise for hundreds of people and allowing vital workers to continue to afford to live in the borough in which they work.",NA,NA
"ELECTED GREENS DELIVERING",NA,NA
"Green Party Co-Leader Sian Berry was elected to the London Assembly in 2016. During that time she has campaigned relentlessly for the introduction of rent controls to ease the pressure on the city’s renters, repeatedly demanding at Mayoral Question Time that action be taken. The pressure has paid off – in July 2019 London Mayor Sadiq Khan formally asked the government for powers to introduce London rent controls.",NA,NA
"Restoring the NHS","H",NA
"The NHS has an amazing history.","504",NA
"We want it to have an even brighter future.","504",NA
"We will build on the founding principles of the Health Service - universal, publicly provided healthcare free at the point of delivery - to widen and enhance the services provided.","504",NA
"This will include fit-for-purpose mental and reproductive health services available to all.","504",NA
"The increased funding that will enable this will be complemented by a devolution of healthcare, with communities given more control over health services .","301",NA
"and individuals supported to take steps to improve their own health.","504",NA
"Our plan to restore the NHS will: Increase funding for the NHS by at least £6 billion per year each year, until 2030 (a 4.5% increase on the 2018/2019 NHS Budget),","504",NA
"and a further £1 billion a year in nursing higher education, allowing for nursing bursaries to be reinstated.","504",NA
"This will constitute a programme of sustained investment, bringing spending of health services in the UK up to northern European averages.","504",NA
"Roll back privatisation of the NHS, through repealing the Health and Social Care Act 2012 and abolishing the internal market.","413",NA
"This reduce private sector involvement in the NHS, which has proved to be a costly and dangerous distraction from universal healthcare provision.","413",NA
"Replace private sector involvement in the NHS with community leadership.","413",NA
"We will allow local authorities to lead a ‘bottom up’ process, and services will be planned and provided without contracts through Health Boards, which could cover more than one local authority area if there were local support.","301",NA
"Provide stronger powers to Health and Wellbeing boards to represent the interest of the public in the NHS.","301",NA
"Reinstate the Health Secretary’s duty to provide services throughout England and create a duty to ensure there are enough health and care staff - including nursing - to meet the needs of the population.","504",NA
"Focus funding to enable the construction of new community health centres, bringing health services closer to people’s homes.","504",NA
"These health centres will pioneer preventative healthcare, helping people live healthier lifestyles so that they are less likely to fall ill.","504",NA
"Focus funding to enable major improvements to mental health care to truly put it on an equal footing with physical health care,","504",NA
"and ensure that everyone who needs it can access evidence-based mental health therapies within 28 days.","504",NA
"We will ensure that tailored and specific provision is readily available for the particular needs of Lesbian, Gay Bisexual, Trans, Intersex, Queer and Asexual (LGBTIQA+) and Black Minority Ethnic (BME) communities, children and adolescents, and older people.","503",NA
"Focus funding to provide better reproductive health services.","504",NA
"We will ensure that all forms of birth control are free, to give women a real choice of the birth control that works best for them.","504",NA
"We will also ensure that PrEP - a daily pill which prevents HIV infection - is provided by NHS England without delay.","504",NA
"Unlocking education","H",NA
"Education should be about nurturing potential and inspiring a love of learning.","506",NA
"Yet all too often it can feel like a production line, manufacturing children-shaped pieces to fit gaps in the workplace.","506",NA
"The freedom to let children play, flourish and grow has been replaced with endless testing and measuring.","506",NA
"It demoralises teachers and adds yet more pressure on young people.","506",NA
"And we have turned further and higher education into a commodity, when it should be a basic right.","506",NA
"It’s time to build an education system on the principles that learning must be lifelong, liberating and accessible to all.","506",NA
"Education can and should unlock creativity and enable self-expression across all ages.","506",NA
"Our plan to unlock education will: Relieve the financial squeeze on schools after years of education cuts, by increasing funding by at least £4 billion per year.","506",NA
"Focus funding to reduce class sizes down to under 20 in the long term, to help teachers focus on individual pupil needs and create a pleasant learning environment.","506",NA
"Free schools from centrally imposed testing regimes, OFSTED inspections, rigid national curriculum and league tables.","506",NA
"Teachers will be trusted to plan their lessons and assess progress according the needs of their pupils, not to meet one-size-fits-all measurements that currently cause huge stress to pupils and teachers alike.","506",NA
"Formal education will start at 6 years, to allow young children to develop at their own pace.","506",NA
"Those under 6 will remain in early years education, with a focus on play-based learning and access to nature.","506",NA
"Sweden has hugely benefited from using a similar system.","506",NA
"Strengthen the link between schools and the communities they serve, by ending academisation and bringing all schools back into the control of democratically elected local authorities, not private companies,","413",NA
"and empowering local authorities with the responsibility and accountability for education within their communities.","301",NA
"Replace OFSTED with a collaborative system of assessing and supporting schools locally, to improve standards and be accountable to the communities in which they serve.","506",NA
"Create a fully inclusive education system, where children with special education needs are able to access their local school and are fully supported in that school.","506",NA
"This means ensuring accessible buildings, an inclusive curriculum and the provision of specially trained teachers across the school system.","506",NA
"Specialist schools will be retained, for when children and parents would prefer that option.","506",NA
"Introduce an English Climate Emergency Education Act to support schools to teach young people about the urgency, severity and scientific basis of the climate and environmental crises,","506",NA
"and to ensure youth voices are heard on climate issues.","501",NA
"We will also enable more outdoor lessons, where children will learn more about nature, animals and the environment, and a new Nature GCSE.","506",NA
"Restore arts and music education in all state schools, to enable children to develop their creative potential.","502",NA
"Make sure all children get at least a half-day equivalent of sports in school","502",NA
"and encourage both the use of schools sports facilities by the community and participation in regional and national sporting events by our young people.","502",NA
"Remove charitable status from private schools and charge full VAT on fees.","503",NA
"The private school sector will be subject to regular independent audits, to ensure private schools improve accessibility and pay their taxes in full.","503",NA
"Ensure that all children receive the basic elements of a good childhood: a decent place to live, safety and security in their community, time and space to play, as well as opportunities to learn and develop inside and outside of school.","503",NA
"Revive the further education sector to provide a wider choice of academic and vocational learning.","506",NA
"We will also raise the funding rate for 16-17-year-olds, followed by an annual rise in line with inflation,","506",NA
"at the same time as introducing a capital expansion fund for sixth form providers.","506",NA
"Fully fund every higher education student","506",NA
"and scrap undergraduate tuition fees.","506",NA
"University will be fully accessible, with courses being offered as learning experiences, not as pre-work training.","506",NA
"Education will be for education’s sake.","506",NA
"Write off existing debt for former students who studied under the £9k tuition fee regime.","506",NA
"Increase funding for adult education across England and Wales, creating a range of new adult education programmes for learners to access.","506",NA
"These programmes will be integrated with Green New Deal training projects.","411",NA
"Restoring our nature and countryside","H",NA
