"text","cmp_code","eu_code"
"Our countryside is a precious resource – a home for people and wildlife, a source of employment, a place of enjoyment for those who visit its wealth of landscapes.","501",NA
"It is vital for our common health, prosperity and wellbeing.","501",NA
"Yet this national treasury is under threat.","501",NA
"The amount of farmland, woodland and forest destroyed by development has grown by nearly 60% in recent years,","416.2",NA
"whilst over 10,000 miles of footpaths have been blocked, built over or allowed to fall out of use.","416.2",NA
"Nature is under attack from industrial farming, over fishing, hunting and shooting - with devastating impacts for wildlife species and their habitats, from farmland to the hills to the coast.","501",NA
"It’s time for an approach that recovers, rebuilds, restores, regenerates and reinstates nature and the health of our countryside.","501",NA
"We have a plan to transform and reconnect with the countryside, which will: Create a new ‘ecocide’ law to prevent crimes against the natural environment.","501",NA
"Amend the National Planning Policy Framework so it no longer imposes centrally set development targets on local councils.","301",NA
"We will allow councils to develop their own planning policies, based on genuine local housing need","301",NA
"and their requirement to contribute to the creation of at least 100,000 new council homes a year nationally.","504",NA
"Councils will be required to deliver these new homes in a way that preserves local ecology and creates6 new green spaces.","416.2",NA
"Strengthen Green Belt, Areas of Outstanding Natural Beauty and Sites of Special Scientific Interest protections,","501",NA
"with development in these areas only being permitted in exceptional circumstances.","416.2",NA
"Ban mineral extraction, road building and military training from all National Parks.","501",NA
"We will give local communities a say in National Park governance, though creating new democratically elected positions on National Park boards.","301",NA
"Open up car-free access to the National Parks with new cycling, walking and bus links.","501",NA
"Encourage applications from communities for new Green Belt, Area of Outstanding Natural Beauty and National Park designations.","501",NA
"Create a new Environmental Protection Commission (EPC).","501",NA
"This will be one integrated body to enforce environmental protections, from clean air to litter-free roads.","501",NA
"The EPC will enforce the ecocide law,","501",NA
"a new Clean Air Act, which will set new air quality standards for the UK,","501",NA
"and a new Sustainable Economy Act, including targets for new soil quality and biodiversity standards.","501",NA
"Develop a soil health monitoring programme for England, to match those in Scotland and Wales, to assess and understand changes in the health of soil over time.","501",NA
"Increase funding for the Environment Agency and Natural England, to support the vital work they do to protect our environment.","501",NA
"Immediately ban the most harmful pesticides (including glyphosate)","501",NA
"and introduce new rigorous tests for pesticides.","501",NA
"Only pesticides that pass this test, and demonstrably don’t harm bees, butterflies and other wildlife, will be approved for use in UK.","501",NA
"Invest in peatland restoration and end both the burning of peatlands and use of peat in compost in horticulture.","501",NA
"We will advocate an emergency international agreement to conserve and enhance carbon sinks and reservoirs including forests, peat fields and coastal and estuarine areas.","501",NA
"Protect our precious water supplies by enforcing stricter penalties for polluters","501",NA
"and for water companies found to be extracting too much water.","501",NA
"We will require water companies to invest in water conservation and in capturing water surpluses, to enable transportation across the country.","501",NA
"Restore access to the countryside by re-opening lost public rights of way and creating new ones.","501",NA
"We will grant to people in England and Wales the same right to roam over all landscapes as people in Scotland currently enjoy.","201.2",NA
"We will protect and enhance access to inland waterways.","501",NA
"Invest in ecotourism and associated schemes such as rewilding, habitat recovery and species reintroduction,","501",NA
"creating new job opportunities.","701",NA
"Introduce new support for small- scale family farms and for new entrants to farming.","703.1",NA
"This support, including increased security of tenure for farmers, will help develop sustainable farming methods.","703.1",NA
"Farmers will be supported to adopt diverse uses for agricultural land and buildings, such as fitting solar panels on farm buildings and planting orchards and other woodland.","703.1",NA
"The incorporation of trees into farming will provide new crops such as fruits and nuts, as well as timber, linking forestry and farming industries.","703.1",NA
"A more densely wooded and hedged farming landscape will provide new habitats for wildlife, and sanctuaries for threatened species.","703.1",NA
"As a member of the EU we will press for a review of the Common Agricultural Policy,","108",NA
"so that it is focussed on supporting UK and other EU farmers as they make the transition to sustainable farming.","703.1",NA
"Commit to making at least 30% of UK domestic waters into fully protected marine protected areas by 2030.","501",NA
"We will also work with British Overseas Territories (BOTs) to increase the ‘blue belt’ protecting BOTs’ waters from commercial extraction, from the current 32% of coverage to 50%.","501",NA
"Reintroduce nature into our urban environments, by investing in schemes such as street planting of native trees,","501",NA
"compulsory hedgehog holes in all new fencing","501",NA
"and bee corridors.","501",NA
"Recognise access to diverse nature as a human right and uphold it across society.","201.2",NA
"Create a Nature GCSE to encourage children to value nature, and to grow a whole new generation of naturalists.","501",NA
"We will also introduce an English Climate Emergency Education Act to support schools to teach young people about the urgency, severity and scientific basis of the climate and environmental crises,","501",NA
"and to ensure youth voices are heard on climate issues.","706",NA
"These policies will integrate closely with those set out in the ‘Green New Deal for food, farming & forestry’ section of this Manifesto on page 21, reducing the carbon emitted from the use of the UK’s land.","501",NA
"Tackling discrimination","H",NA
"Despite huge social progress over the past century, we still live in a society where factors like our gender, ethnicity and sexuality play a part in how we are treated.","503",NA
"The Green Party wants to actively challenge discrimination and exclusion, at the same time as creating opportunities for everyone to flourish.","503",NA
"In doing so we recognise that rights for one group should not take away rights from others - that none of us are equal until we all are.","503",NA
"Our Green plan to transform society and end discrimination will: Establish a cross-government strategy tasked with tackling ethnic inequalities, ranging from school exclusions through to biased treatment in the criminal justice system, and covering housing, employment and health.","503",NA
"Replace ‘Prevent’ with community cohesive policing which engages rather than antagonises Black Minority Ethnic (BME) communities and addresses concerns about the use of stop and search powers.","605.2",NA
"End the hostile environment which puts migrants, from the EU and further afield, at risk and increases racism and anti-immigrant sentiment.","503",NA
"This will include ending indefinite detention, closing the immigration detention centres and ending the culture of abuse and violence that has prevailed in them.","503",NA
"We will immediately suspend all deportation flights and allow refugees to live freely, with a right to work, whilst their applications are considered.","201.2",NA
"Create a new Ministry for the Interior that will be fully committed to upholding human rights.","201.2",NA
"This Ministry will have responsibility for protecting the fundamental rights of Travellers, a group that are often overlooked in efforts to end discrimination.","201.2",NA
"Make a ‘Windrush Day’ bank holiday, to celebrate the contribution that migration has made to our society.","607.1",NA
"Bring forward a new humane immigration system with no minimum income rules for visas,","201.2",NA
"full workplace rights for migrants,","201.2",NA
"the right to work for asylum seekers","201.2",NA
"and recourse to public support for migrants and asylum seekers who need it.","201.2",NA
"Confront racism, antisemitism and prejudice, including from an early age through a broader and decolonialised curriculum in school, focussing on histories and role models from a diverse range of ethnicities and religions.","607.1",NA
"Guarantee safe and discreet access to public services such as the police, health and education, so that migrants can access these without fear of being subject to immigration enforcement.","201.2",NA
"We will also abolish the draconian powers brought in under the 2014 and 2016 Immigration Acts and scrap health charging for migrants.","504",NA
"Defend the right of people of all faiths - to express their faith, be that in religious clothing, food or reasonable accommodation of religious observance.","603",NA
"We will also work with religious communities to defend the safety of places of worship.","603",NA
"Retain the Human Rights Act","201.2",NA
"and reaffirm the UK’s commitment to the European Convention on Human Rights.","201.2",NA
"Make misogyny a hate crime across the UK","605.1",NA
"and increase the police’s capacity to deal with domestic violence and misogynistic hate crimes.","605.1",NA
"Funding to support the prevention and prosecution of all hate crimes will be increased,","605.1",NA
"and police officers will be given further training in this area.","605.1",NA
"We need an intersectional approach to hate crime, which recognises the groups of women who are most at risk.","605.1",NA
"Develop and implement a UK-wide strategy to tackle gender-based violence, including domestic violence, rape and sexual abuse, Female Genital Mutilation (FGM), and trafficking.","605.1",NA
"This will include working with perpetrators to prevent them from continuing to abuse.","605.1",NA
"We will also reverse cuts to legal aid to prevent survivors being forced to represent themselves against their abusers in court","605.1",NA
"and introduce a new Domestic Abuse Bill, which enables prosecution of economic abuse.","605.1",NA
"Roll back the cuts to domestic violence support centres and women’s refuges, and increase funding to provide more safe and secure accommodation for women and their children.","503",NA
"Put funding for Rape Crisis Centre services on a sustainable footing so that every survivor of sexual assault or violence receives proper support.","503",NA
"We will increase and ring fence the Rape Support Fund and ensure funds are provided via the Victim Surcharge.","503",NA
"Establish a new press regulatory regime which will allow women to make formal complaints about media coverage that will encourage misogyny against women.","605.1",NA
"This regime will allow for third party complaints to be made, on behalf of women negatively affected by media coverage.","605.1",NA
"Media-led misogyny affects women of all backgrounds, all ethnicities, all religions, cis and trans, lesbian, bisexual and straight – it’s time to end it once and for all.","503",NA
"Introduce a regulatory framework for online harms to ensure social media companies take responsibility for how their platforms are being used","403",NA
"and invest in technological solutions to address misogyny and online harassment.","411",NA
"Extend the EU’s Charter of Fundamental Rights to give women in all EU countries access to legal, safe and affordable abortion services.","604",NA
"Support employers to explore the benefits of offering menstruation and menopausal leave to workers.","701",NA
"Improve access to high quality care during pregnancy and ensure that all women are entitled to the care of a single midwife through prenatal care, birth and the first month of post-natal care.","504",NA
"Baby clinics will be expanded, so that women can get access to health visitors and take their babies for regular check¬ups at a location and time that is convenient for them.","504",NA
"Increase funding for areas of the NHS heavily relied on by Lesbian, Gay, Bisexual, Trans, Intersex, Queer and Asexual (LGBTIQA+) people, including trans healthcare, gender identity clinics, HIV treatment and mental health provision.","504",NA
"Properly fund training to support the delivery of comprehensive, age- appropriate Personal Health and Sexual Education (PHSE) lessons in schools covering all aspects of sex and relationships, with a focus on consent.","506",NA
"End the opt-out of LGBTIQA+ inclusive PHSE classes at school to ensure that every child learns about different types of couples and families that make up UK society.","604",NA
"Train school staff in spotting and stopping sexual harassment and bullying, to ensure that schools are safe places for all to learn in.","506",NA
"Fund schools to provide free eco- friendly sanitary products to pupils.","506",NA
"Remove the spousal veto so that married trans people can acquire their gender recognition certificate without having to obtain permission from their spouse.","503",NA
"We will also change the law so an X gender marker can be added to passports for non-binary and intersex people who wish to use it,","503",NA
"and update the Gender Recognition Act to allow trans youth and non-binary people to get legal recognition through self-declaration.","503",NA
"Introduce a legal right to independent living for disabled people, overseen by a National Independent Living Support Service.","503",NA
"This service will support and empower disabled people who do choose to live independently.","503",NA
"Fully embed the UN Convention on the Rights of Persons with Disabilities (UNCRPD) into UK law.","201.2",NA
"This will mean that the unacceptable practices of compulsory treatment, chemical and physical restraint, isolation, and seclusion are made illegal in the UK.","201.2",NA
"ELECTED GREENS DELIVERING",NA,NA
"Combatting Hate Crimes Against Women",NA,NA
"In 2017 Green Party Deputy Leader Amelia Womack called for violence against women motivated by their gender to be considered a hate crime, saying:",NA,NA
"‘From domestic abuse to rape, groping to stalking and harassment, we know that women suffer abuse because of their gender. The Home Office does not record hate crimes according to gender and to me that’s a powerful symbol of the way misogyny is treated in this country: sidelined, ignored, brushed under the carpet. ’",NA,NA
"Amelia and the Green Party joined forces with cross-party campaigners on this issue, to keep up the pressure on government to take action. In September 2018 the Ministry of Justice announced that they had asked the Law Commission to undertake a review of the coverage and approach of hate crime legislation, including consideration of how gender characteristics should be considered by hate crime law.",NA,NA
"Preventing crime","H",NA
"Everyone has the right to feel safe - on the street, in their home or online.","605.1",NA
"Simple things like more police on the beat and enforceable laws against malicious trolling can make a huge difference.","605.1",NA
"However, not all crime can be tackled by being tough.","605.2",NA
"Punishment for its own sake is ineffective.","605.2",NA
"It might make us feel better, but it doesn’t change very much.","605.2",NA
"The Green Party thinks it’s time to transform our justice system.","605.2",NA
"We want to tackle the underlying causes of crime more effectively than CCTV cameras, stop and search or draconian sentencing can ever do.","605.2",NA
"So we will focus on the prevention of crime with community-based policing, alongside investment in education and employment.","605.2",NA
"Overall, we aim to halve the prison population, as has successfully been achieved in the Netherlands, breaking the vicious cycle of reoffending.","605.2",NA
"60% of newly released short-term prisoners reoffend in the year after their release, often graduating to more serious crimes than the one for which they were originally imprisoned.","605.2",NA
"We will expand restorative justice when crimes do take place, both to give victims a voice and to help offenders see the effects of what they have done and take responsibility.","605.2",NA
"The Green Party’s plan to make everyone safer will: Significantly reduce the number of short-term prison sentences handed out, replacing them with restorative justice projects that have a better record of preventing reoffending.","605.2",NA
"Enhance the rehabilitation services on offer to long-term prisoners, commissioning rehabilitation services that have a track record of success.","605.2",NA
"Follow the evidence that shows that prison is particularly counter¬productive for women, trapping them in lives of crime.","605.2",NA
"We will therefore support and develop a network of specialist women’s centres in order to reduce the female prison population.","605.2",NA
"These small-scale custodial centres will offer pastoral support to women to address the issues that led to them offending.","605.2",NA
"Invest in youth services and centres, to help turn at-risk children away from crime.","605.2",NA
"All the evidence shows the cuts in youth services have increased crime, especially knife crime.","605.2",NA
"To end knife crime once and for all we need to invest in specialist programmes provided through youth centres","605.2",NA
".",NA,NA
"End the war on drugs, which has trapped hundreds of thousands of people into lives of crime","605.2",NA
"and treat drug addiction as a health condition, not a crime, building on the successful approaches pioneered in Portugal and other countries (see below page on ending the war on drugs for further information).","605.2",NA
"Integrate police forces more closely with the communities they serve by creating new community liaison and equality officers to work on positive relations and by putting more police on the beat.","605.1",NA
"Ending the war on drugs","H",NA
"Taking drugs can be dangerous but prohibition of drug use has created many more problems than it has solved.","605.2",NA
"Over the last 50 years, the international war on drugs has been a resounding failure.","605.2",NA
"Harmful drug consumption has markedly increased and has given rise to a multi-billion pound illegal industry that has fuelled organised violent crime","605.2",NA
"and caused untold social and ecological destruction.","605.2",NA
"There is little evidence for the two core assumptions that form the basis of current UK drug policy:","605.2",NA
"1. That supply-side enforcement can reduce drug availability and use.","605.2",NA
"2. That the criminalisation of people who use drugs is an effective deterrent.","605.2",NA
"The Green Party recognises that people have always and will always use drugs, including alcohol.","605.2",NA
"Drugs perform many purposes in society, including recreational use and as part of medical treatment.","605.2",NA
"Seeking to prevent drug use is demonstrably futile; we need a radically new system grounded in harm reduction.","605.2",NA
"Government needs to strike the right balance between responsible adult drug use and the potential harms of problematic use.","605.2",NA
"The taxes and licence fees that will apply to drugs under our proposed system will raise significant revenues.","605.2",NA
"Some of these revenues will pay for the harm that drug use can cause, including NHS time.","605.2",NA
"Our Green plan to reduce harm and adopt an evidence-based approach will: Repeal the Misuse of Drugs Act 1971 and the Psychoactive Substances Act 2016.","605.2",NA
"Pardon and expunge the criminal records of all individuals previously convicted for possession and small-scale supply of drugs.","605.2",NA
"Enable medical scientists to conduct research on psychoactive drugs to develop new treatments for mental and physical illnesses.","605.2",NA
"Invest in education and treat problematic drug use as a health issue, not a crime, building on the successful approaches pioneered in numerous other countries.","605.2",NA
"Replace the current system of prohibition with an evidence-based, legalised, regulated system of drug control.","605.2",NA
"The production, import and supply of all drugs will be regulated according to the specific risks that they pose to the individual, to society and to the environment.","605.2",NA
"Make heroin available on prescription after a medical assessment by a doctor","605.2",NA
"and provide safe facilities for users who inject drugs, building on the success of drug consumption rooms in other countries which have encouraged more problematic drug users into treatment.","605.2",NA
"Regulate access for adults to stimulant and psychedelic drugs based on the evidence around harm reduction through pharmacies, after a safety consultation with a qualified pharmacist,","605.2",NA
"at fixed doses and fixed prices.","412",NA
"Make cannabis, labelled according to laboratory-tested strength, available to adults from licensed small businesses.","605.2",NA
"Cannabis will be sold subject to minimum unit pricing and plain packaging.","412",NA
"Allow for licensed Cannabis Social Clubs where adults can collectively cultivate and consume cannabis","605.2",NA
"and allow adults to grow a limited number of cannabis plants at home.","605.2",NA
"Prohibit commercial advertising of alcohol (and all other drugs)","403",NA
"and introduce minimum unit pricing, which has been shown to reduce harmful drinking in Scotland.","412",NA
"Set up an independent statutory body, the Advisory Council for Drug Safety, comprised of experts, who will be responsible for monitoring patterns of drug use, advising the government on changes to regulation and sourcing socially and ecologically sustainable supplies of opium and coca from the Global South.","605.2",NA
"Transforming our relationship with animals","H",NA
"We share this planet with, and are dependent on, a wealth of other animal species.","501",NA
"Yet wildlife destruction, factory farming, live export, companion and domestic animal abuse, and the use of animals for experiments, sport and entertainment are all contributing to the systematic mistreatment of animals.","501",NA
"We think it’s time for a better future, where animals are actively protected from cruelty and our own quality of life is improved too.","501",NA
"The Green plan to transform understanding of the relationship between humans and animals will: Guarantee the principle of animal sentience.","501",NA
"This will mean that that regard for the welfare needs of animals as sentient beings is uppermost in formulating and implementing relevant government policy.","501",NA
"Ban all hunting.","501",NA
"This includes trail hunting, where dogs are used to track foxes who are then shot,","501",NA
"and the commercial shooting of deer and game birds.","501",NA
"Government subsidies, used to maintain artificial landscapes designed only for hunting (such as grouse moors) will be ended and the land rewilded where possible.","501",NA
"Where necessary for ecological reasons, humane culling will be licensed by Natural England and carried out by trained professionals.","501",NA
"We will also ban the use of lead ammunition and outlaw all forms of snaring.","501",NA
"End the badger cull, which has no evidence basis and has failed to effectively reduce Bovine TB.","501",NA
"We will fund research into a sensitive test to enable cattle vaccination, as an essential, as well as humane, part of a meaningful strategy to control the spread of the disease.","501",NA
"We will also invest in better farm bio-security and badger vaccination.","501",NA
"Stop the use of primates, cats and dogs in research","501",NA
"and the importation of monkeys for use in labs,","501",NA
"and work towards an outright ban on all animal testing.","501",NA
"We will also end the use of live animals in military training.","501",NA
"Enforce tougher regulations on animal transportation, including a maximum limit of eight hours travel for animals in transit","501",NA
"and an end to all live exports from our shores.","501",NA
"We will work to minimise all stress- causing practices during production of animal-based food products.","501",NA
"Advocate for European legalisation to end factory farming,","501",NA
"prohibit the routine use of antibiotics for farm animals,","501",NA
"and ban the killing of animals for sport across the EU.","501",NA
"Call on all nations to declare the waters under their control as havens from whaling,","501",NA
"to provide sanctuary throughout those waters for cetaceans (whales and dolphins),","501",NA
"and to co-operate in achieving global sanctuary for cetaceans in the longer term.","501",NA
"Implement a complete ban on cages and close confinement","501",NA
"and deliberate mutilation of farm animals.","501",NA
"Help shoppers choose cruelty free food, with mandatory method of production labelling for meat, milk and dairy products.","501",NA
"Protect animals that give companionship or support.","501",NA
"We will enhance regulation and controls on breeding, sale and import, with compulsory licensing applying to everyone working with animals.","403",NA
"Those convicted of cruelty will be placed on an animal cruelty register and prevented from working with animals again.","605.1",NA
