"text","cmp_code","eu_code"
"local economies starved of investment,","301",NA
"run down public services","504",NA
"and jobs without dignity.","701",NA
"We will make staying and fighting for the Europe we want a pathway to change","108",NA
"- to a society that is genuinely fair, green and fulfilling.","501",NA
"Greens will play a leading role in mobilising a positive pro-European movement","108",NA
"that has young people at its heart.","706",NA
"We have demonstrated that we are willing to work across party boundaries to resist Brexit, and will continue to do so.","108",NA
"We will inspire a vote to remain with a vision of the way membership of the EU can improve all our lives.","108",NA
"And whatever happens, we will guarantee the full rights of EU citizens and their families living in the UK, including the right to automatic settled status","201.2",NA
"and ensure there is no rolling back of the rights and protections enshrined in the EU Charter of Fundamental Rights.","201.2",NA
"A Green vote in this General Election is an opportunity to choose remaining in the EU and transforming the UK.","108",NA
"It’s an opportunity to choose a People’s Vote.","202.1",NA
"It’s an opportunity to choose Project Hope over Project Fear.","606.1",NA
"Transforming the European","H",NA
"Being part of the European Union offers us the best chance of facing down the big challenges of the future - from climate chaos to international terrorism.","108",NA
"We are fully committed to working collaboratively with our closest neighbours to resolve the common issues we face","108",NA
"and in the pursuit of peaceful and prosperous lives for all.","108",NA
"The Green Party believes in this vision of international bridges, not walls,","108",NA
"and is committed to realising it through building a truly democratic EU","108",NA
"that delivers social rights and opportunities for all its citizens.","201.2",NA
"As Greens we have campaigned hard to keep the UK in the EU","108",NA
"whilst also being strong voices for change and reform within the EU.","110",NA
"It’s time to transform the EU into a beacon of democracy,","202.1",NA
"as well as making it more accountable and transparent.","202.1",NA
"We want to build on the positive changes secured by Green MEPs in Europe so far,","108",NA
"to further rebalance power within the EU in favour of citizens and national self-determination,","201.1",NA
"and away from corporate dominance.","108",NA
"We believe this will lead to a renewed focus on the EU’s potential to deliver effective solutions to poverty,","503",NA
"inequality","503",NA
"and climate chaos","501",NA
"- and help secure a long-term, positive future for the UK in the EU.","108",NA
"Our plan to transform Europe will: Allow Members of the EU Parliament to initiate Europe-wide legislation, something they don’t currently have the power to do.","108",NA
"In time, we hope that the European Parliament will become the main source of new European legislation to improve the lives of citizens.","108",NA
"Allow groups of EU citizens to propose reforms to the EU treaties.","108",NA
"New rules will require every citizen initiative to receive a response, setting out how it will lead to concrete action being taken by the EU.","108",NA
"Increase the transparency of European institutions, including the European Central Bank, with steps such as live streaming all meetings, and publishing minutes and key papers like trade negotiation documents.","202.1",NA
"Citizens have the right to know how decisions are made and how their money is spent.","202.1",NA
"Open up the European Council by making positions taken by Member States public.","202.1",NA
"Introduce a binding lobbying register for all EU institutions and set up an independent body to supervise its operation,","202.1",NA
"as well as other rules on transparency and ethics.","202.1",NA
"Campaign for the operations of the EU to be centred in Brussels, ending the wasteful transfer of EU staff and operations between Brussels and Strasbourg.","108",NA
"Champion reform of the Common Agricultural Policy, so that it promotes more sustainable farming methods.","501",NA
"We will also press for a review of the Common Fisheries Policy in order to increase its sustainability.","501",NA
"Advocate for the EU to prioritise policy areas where cross-border co-operation can help deliver real change.","108",NA
"These include: Linking up national Green New Deals, to pool renewable energy resources and share insights and expertise.","416.2",NA
"Co-ordinating crackdowns on tax avoidance and evasion, so no one seeking to hide from tax rules can do so anywhere in the EU.","605.1",NA
"Harmonising minimum environmental standards.","501",NA
"As nature knows no borders, the EU can play a major role in ensuring that habitats split between different counties are all protected by the same rules.","501",NA
"Enforcing social rights and protections for citizens,","201.2",NA
"such as a guaranteed minimum income for all workers.","701",NA
"Reducing migration in the long term, by correcting imbalances caused by labour-market inequalities across Europe.","108",NA
"EU policies hold the key to this, including an EU-wide minimum income guarantee,","108",NA
"EU-wide minimum wages,","108",NA
"and fiscal transfers via the Euro.","108",NA
"Working for peace, security","106",NA
"and human rights.","201.2",NA
"The EU was developed by WWII veterans to support peace in Europe and we celebrate the success of this peace mission.","106",NA
"Enshrine Freedom of Movement as a core principle of the EU - enabling people to freely live, learn and love without borders.","201.2",NA
"Reform European refugee policy, centring it on principles of humanity and compassion.","201.2",NA
"We will campaign to re-establish a European sea-rescuing mission, to save all lives in danger in European waters.","201.2",NA
"Press for an urgent review on the safety of all migrants travelling to and across Europe.","201.2",NA
"Advocate for European legalisation to end factory farming","501",NA
"and to reduce transportation times for animals, including the halting of all live animal exports from the UK.","501",NA
"We will work to ban the killing of animals for sport across the EU.","501",NA
"Extend the EU’s Charter of Fundamental Rights to give women in all EU countries access to legal, safe and affordable abortion services.","604",NA
"Support the introduction of an EU-wide carbon tariff on countries that are not reducing their carbon emissions, to further encourage global action on the Climate Emergency.","501",NA
"ELECTED GREENS DELIVERING:",NA,NA
"Decriminalising Humanitarian Assistance to Refugees",NA,NA
"In June 2018 Green Members of the European Parliament proposed a motion calling on EU states to stop criminalising humanitarian assistance for desperate refugees. This came after cases when countries had detained and tried to prosecute European citizens working to save the lives of refugees at risk of drowning in the Mediterranean.",NA,NA
"The motion was won by the Greens, with then Green MEP for London Jean Lambert saying:",NA,NA
"‘I am delighted that the European Parliament has sent out a strong message calling on the European Commission and EU Member States to stop criminalising those who provide humanitarian assistance to people in desperate and life-threatening situations. We can, and must, do better. ’",NA,NA
"GROWING DEMOCRACY","H",NA
"Unleashing a Democrativ Revolution","H",NA
"Brexit laid bare the extent to which our governance structures are derelict, but our democracy has been broken for a long time.","202.1",NA
"The First Past the Post voting system means that often more than half of all votes cast simply don’t count.","202.1",NA
"The House of Lords gives power to people who have never been elected","202.1",NA
"and our political representation doesn’t reflect the diversity and reality of the modern UK.","202.1",NA
"We are one of the most centralised countries in Europe, with disproportionate power held at Westminster, and far too little in our regions and local authorities.","301",NA
"These flaws allow those who traditionally hold power to keep hold of power, at the expense of the rest of us.","202.1",NA
"The Green Party will fix our democracy, so that it becomes an effective tool for redistributing power away from the privileged and towards the people.","202.1",NA
"We want an active democracy in which we can all believe and trust.","202.1",NA
"We think it’s time for every vote to always count","202.1",NA
"and for citizens’ assemblies to develop a written People’s Constitution","202.4",NA
"and explore how as a country we can ensure the fair redistribution of power.","202.1",NA
"The Green Party’s plans to unleash people power and grow democracy will :Replace the First Past the Post system for parliamentary elections with a fair and proportional voting system.","202.1",NA
"We are champions of the Good Systems Agreement, a cross-party commitment to democratic reform brokered by the Make Votes Matter campaign group.","202.1",NA
"Replace the First Past the Post system for local government with a fair and proportional voting system.","202.1",NA
"Voters will be asked to elect half the Council every two years to ensure that fast changing local concerns and priorities can be expressed at the ballot box on a regular basis.","202.1",NA
"Create a fully elected House of Lords.","202.1",NA
"Members will be elected for a maximum of ten years with half of the house being elected every 5 years.","202.1",NA
"Give 16- and 17-year-olds the right to vote and have a say on their future.","202.1",NA
"We will also allow people to stand for Parliament and all other elected offices from the age of 16, offering support to elected young people so that they can combine their duties with studying.","202.1",NA
"We are proud to march with the inspiring Youth Strike activists against climate chaos","501",NA
"and know the passion and wisdom young people can inject into our policies.","706",NA
"Introduce job-sharing, at all levels of government, to make politics more accessible, especially for disabled people and people with caring responsibilities.","202.1",NA
"We will expand the Access to Elected Office Fund to support disabled people to stand for election, and support women, non-binary people and those from minority ethnic backgrounds to stand.","202.1",NA
"Require all political parties to report the diversity of their candidates, so that progress in selecting more women and minorities to contest Westminster and local government seats can be monitored.","202.1",NA
"This was set out in Section 106 of the Equality Act 2010 but has yet to be implemented.","503",NA
"Implement a fair system of state funding for political parties to eliminate dependence on large private donations, removing the undue influence large donations can give corporations and the super wealthy.","304",NA
"Remove the cap on fines that can be imposed by the Electoral Commission on political parties that have been found to have breached electoral law.","304",NA
"Strengthen the transparency rules on recording political lobbying","304",NA
"And make the work of Think Tanks more transparent too, by establishing a distinct legal entity for political foundations which conduct policy research and political education.","202.1",NA
"Protect the BBC,","502",NA
"reinstate free TV licences for over-75-year-olds","503",NA
"and tighten the rules on media ownership so no individual or company owns more than 20% of a media market.","403",NA
"To further challenge the control of our media by big tech and unaccountable billionaires, the Green Party will ensure that a suitable independent regulator is better able to safeguard a healthy plurality of media ownership, to undertake regular plurality reviews and to trigger remedies where necessary.","403",NA
"The recommendations of the 2012 Leveson Report will be implemented, to hold the UK press to high ethical standards.","403",NA
"Support, through new grants, the growth of a wider range of civic- minded local news publishers.","403",NA
"Local newspapers in the UK are an important part of our democracy and culture yet many are closing or struggling to survive.","601.1",NA
"Introduce a Digital Bill of Rights that establishes the UK as a leading voice on standards for the rule of law and democracy in digital spaces","202.1",NA
"and ensure independent regulation of social media providers.","403",NA
"This legislation will safeguard elections by responding to the challenges of foreign interference, social media and declining confidence in democracy.","202.1",NA
"End the sale of personal data, such as health or tax records, for commercial or other ends.","403",NA
"Revive the role of democratic trade unions.","701",NA
"Back a Citizens Convention and citizens assemblies to examine further ways to strengthen democracy,","202.1",NA
"including developing a written People’s Constitution and Bill of Rights, and ensure the proposals come before Parliament.","202.1",NA
"This will enshrine genuine democracy at the core of our political system, making sure that ultimate power will always rest with the people.","202.1",NA
"Give fuller voice to regional and national identities,","301",NA
"holding a referendum on a Cornish Assembly","202.4",NA
"and increasing the powers of the current National Assembly for Wales.","301",NA
"Tackle our toxic political culture, by exploring measures such as new codes of conduct to embed compassion and co-operation in all aspects of public life.","304",NA
"Introduce a public interest defence for breaching the Official Secrets Act,","606.1",NA
"alongside better protection and support for whistle-blowers in the public and private sectors.","606.1",NA
"Protect the right to peacefully protest","201.2",NA
"and prevent disproportionate police responses to protest.","605.2",NA
"ELECTED GREENS DELIVERING",NA,NA
"More Local Democracy",NA,NA
"In 2018 Green councillors successfully campaigned for Worcester City Council to move from a Cabinet system, where power was concentrated in the hands of one party, to a Committee system requiring all councillors to work together. Across the country Green councillors campaign to open up decision making and increase community involvement in it.",NA,NA
"Shaking up central government","H",NA
"A safer, fairer future for all will only be delivered with effective central government.","305.3",NA
"Yet right now we have an out of control executive attacking the independence of the courts, undermining the rule of law and ignoring the great challenges of our time.","202.1",NA
"We have a Chancellor of the Duchy of Lancaster, a feudal barony from the 14th century, but no Cabinet Minister responsible for combatting the Climate Emergency that threatens the future of every UK citizen.","501",NA
"It’s time to make government fit for purpose today and fit to face the future.","305.3",NA
"We will also transform how Parliament works, to improve accountability","202.1",NA
"at the same time as encouraging greater co-operation and long-term decision making.","303",NA
"We will restore central government to its democratic purpose and core function of making the lives of UK citizens better.","202.1",NA
"The Green Party’s plan to ensure central government serves a modern UK will: Create a new government department to oversee the implementation of the Green New Deal, led by a Carbon Chancellor, based at number 11 Downing Street to put the just transition to a net zero economy right at the heart of government.","501",NA
"The Carbon Chancellor will set a yearly Carbon Budget, which will drive the decarbonisation of the economy.","501",NA
"We will create a fossil fuel free politics, with vested interests who depend on continued fossil fuel use banished from positions of influence","501",NA
"Move away from consumption and Gross Domestic Product as key measures of economic success and towards indicators that measure human and ecological wellbeing, such as work/life balance and quality of life.","416.2",NA
"Introduce a Future Generations Act for England, modelled on the current Act for Wales, building the needs of future generations into every government decision.","501",NA
"We will also appoint a Minister for Future Generations to represent young people at the heart of government.","706",NA
"Empower the Youth Select Committee, currently a learning programme, to scrutinise and hold the government to account like any other Select Committee.","202.1",NA
"Scrap the Home Office, and end its decades-long creation of a hostile environment for Black Minority Ethnic (BME) and other minority communities.","503",NA
"We will instead create a Ministry for Sanctuary","201.2",NA
"and a Ministry of the Interior.","202.1",NA
"The Ministry for Sanctuary will be responsible for enforcing migration rules with compassion, and due regard for human rights,","201.2",NA
"as well as providing recompense for those affected by the Windrush scandal.","201.2",NA
"One of the Ministry of Sanctuary’s first acts will be to abolish income requirements for people wishing to come to the UK to join a loved one - no families should be separated because of how much someone earns.","602.2",NA
"The Ministry of the Interior will oversee domestic security with full regard to human rights","201.2",NA
"and the needs of diverse communities.","607.1",NA
"Replace the Ministry of Defence with a Ministry for Security and Peace, making the promotion of peace a key foreign policy objective","106",NA
"and linking the role of the defence services more closely to the world we now live in -","107",NA
"a central part of their responsibilities will become defending environments around the world from the effects of climate chaos","501",NA
"and dealing with the humanitarian and environmental impacts of climate-related disasters.","501",NA
"Instruct all government departments to work to meet, and when possible exceed, the UK’s commitments under the Paris Agreement of 2015, which committed UN nations to combat climate chaos.","501",NA
"The Foreign Office will be tasked with promoting the Agreement and other international agreements to tackle climate change around the world,","501",NA
"and encouraging nations to uphold them.","107",NA
"Create a legal responsibility for government to give individuals consular support, rather than it being discretionary.","201.2",NA
"Transform how Parliament works with electronic voting,","303",NA
"measures to protect against filibustering,","304",NA
"steps to promote cross-party and co¬operative working,","202.1",NA
"and a systematic overhaul of parliamentary language to make it self-explanatory.","303",NA
"Develop and implement a robust plan for ending bullying and sexual harassment in Parliament.","503",NA
"Close down the government’s arms sales activities, including the Department for International Trade’s Defence and Security Organisation (DSO),","105",NA
"and end all subsidies and support for the UK arms industry’s exporting of weapons and systems that fuel conflicts, violence and suffering across the world.","105",NA
"Stop the gagging of our democracy through the creation of better protections and support for whistleblowers in the public and private sector including a public interest defence for breaching the Official Secrets Act.","202.1",NA
"These policies will integrate closely with those set out in the ‘Green New Deal’ chapter of this Manifesto, ensuring that central government is reshaped around the overwhelming need for green social and economic revolution.","501",NA
"Empowering local government","H",NA
"Across the country, hardworking councillors and council workers strive to improve the lives of people and communities.","504",NA
"They do this at a time of staggering and unprecedented cuts to local government budgets.","504",NA
"Over £50 billion has been slashed from council budgets over the past decade because of central government decisions.","504",NA
"Councils have been forced to close libraries, sell off public land, abandon meals on wheels for older people, close children’s centres, stop repairing roads or no longer collect litter.","301",NA
"We will choose to devolve real power from central to local government, giving councils the tools needed to deliver public services.","301",NA
"Properly resourced and led councils are in the unique position of being able to make real and effective change, bring people together and lead the services people need where they live.","301",NA
"We will reverse spending cuts and restore local government budgets so local councils can afford to serve their communities.","504",NA
"It’s time to transform local government.","301",NA
"In this age of climate chaos, action to secure the future of people and the places they love, led by democratically elected local representatives, is needed more than ever.","301",NA
"We want local councils to lead the delivery of the Green New Deal and the transition to a resilient, zero carbon economy.","301",NA
"We believe this is how to make life better today and create a future where local people and businesses can thrive.","501",NA
"The Green Party’s plan to empower local government will: Increase central government funding to councils by £10 billion a year.","301",NA
"This funding, combined with the local council revenue raising, will enable local government to improve the frontline services they provide and which local people need and want.","301",NA
"We will support councils to also use this funding to nurture arts and culture in their areas, keeping local museums, theatres, libraries and art galleries open and thriving.","502",NA
"Ensure councils can plan with financial certainty by committing to annual, rolling multi-year financial settlements.","301",NA
"Give councils access to an additional £3 billion a year Climate Adaption Fund.","501",NA
"Bids from councils facing the greatest threat from climate chaos,","501",NA
"and councils with the high levels of poverty, will be prioritised as money is distributed from the Fund.","503",NA
"Give all councils power over bus services in their area,","301",NA
"and over franchises for local train services.","301",NA
"Fund councils to deliver new training and skills for residents, to equip them for jobs created by the Green New Deal.","411",NA
"Give councils the power to set their own housing targets,","504",NA
"and to strike the right balance between local housing need and the need to preserve the local environment.","416.2",NA
"Expand the powers of councils to prevent land banking through mechanisms including charging developers who sit on land where permission has been granted","301",NA
"or using compulsory purchase powers to accelerate appropriate development where development is stalled or slow.","416.2",NA
"Give councils the ability to set planning fees locally.","301",NA
"Tax payers are subsidising developers for the costs of their planning applications to the tune of £200 million a year - councils need the power to meet these planning costs not from central funds, but from charging developers realistic fees for the planning services councils provide for them.","301",NA
"Fund councils to deliver additional social housing in their area (over 100,0new homes a year nationally) through sustainable construction, renovation and conversion,","504",NA
"and to improve and insulate existing homes (over 1 million homes a year).","501",NA
"We will also support councils to set more affordable rent rates for social housing tenants in their area by lifting the local housing allowance and reconnecting it to average area rents.","504",NA
"Support councils to better provide housing for disabled people,","504",NA
"supporting every council to draw up their own disability housing plans,","301",NA
"and work to significantly increase the numbers of homes built to mobility standards over the next five years.","504",NA
"Give councils clearer guidance and better training on helping homeless people, including support for the Housing First approach,","504",NA
"a widening of the grounds on which councils can offer help to people without a home,","504",NA
"and the provision of social services once a person is housed.","504",NA
"The extra costs of this can be met from the £10 billion yearly uplift to council funding.","504",NA
"We will refocus council services in this area on homelessness prevention rather than crisis management, through expanding and combining multiple funding pots into a single grant distributed to councils.","504",NA
"We would also repeal the Vagrancy Act 1824, which criminalises street homelessness and can hinder attempts to help those without a home.","605.2",NA
"Provide an additional £4.5 billion a year to fund councils to provide free social care to people over 65 who need support in their own homes.","504",NA
"This model has been in place in Scotland since 2001 and has helped millions of people be cared for in their own homes - it’s time to extend this right to free home care to pensioners in England (care in Wales is devolved to the National Assembly for Wales).","504",NA
"We will also explore how this free social care at home could be extended to everyone who needs it, regardless of age.","504",NA
"Support councils to extend staying put arrangements, to enable fostered young people to stay with foster parents until they are 21.","503",NA
"Task the Department for Housing, Communities and Local Government with reviewing on a rolling basis which powers can be further devolved from central government to local government.","301",NA
"Replace the First Past the Post system for local government with a fair and proportional voting system.","202.1",NA
"Voters will be asked to elect half the Council every two years to ensure that fast changing local concerns and priorities can be expressed at the ballot box on a regular basis.","202.1",NA
