"text","cmp_code","eu_code"
"Foreword","H",NA
"The time to vote Green is now.","305.1",NA
"We know these are dark days.","305.1",NA
"The threat of Brexit hangs over us","108",NA
"and our democracy is under attack.","202.1",NA
"Above all, the climate and environmental emergency rages from the Amazon to the Arctic.","501",NA
"The science is clear - the next ten years are probably the most important in our history.","501",NA
"At this time of crisis, we cannot go on as we are.","501",NA
"If ever there was a time to vote Green, it’s now.","305.1",NA
"We want to unleash a revolution that lifts up everyone.","503",NA
"Our plan for a Green New Deal, and four related programmes of reform, will transform the UK","501",NA
"and improve the quality of everyone’s lives by creating a safer, fairer future for all.","503",NA
"We are the only party you can trust to act in time to tackle the Climate Emergency","501",NA
"in a way that also tackles pressing social problems.","503",NA
"We are the only party you can trust to stand up for remaining part of Europe and for a final say on Brexit,","108",NA
"whilst at the same time tackling the underlying reasons why many people voted to leave.","503",NA
"We are the only party you can trust to fix our broken democracy,","202.1",NA
"by sharing power","301",NA
"as well as wealth more equally, so that we can all be heard.","503",NA
"The Green Party has always been on the right side of history and you can trust us to get the future right too.","305.1",NA
"The choices we make now matter like never before.","601.1",NA
"The UK needs a new start.","601.1",NA
"If not now, then when?","601.1",NA
"This is the manifesto of the Green Party of England and Wales. Separate sister Green parties cover Scotland and Northern Ireland. Many public services are devolved, with the Scottish Parliament, the National Assembly for Wales or the Northern Ireland Assembly taking responsibility. However, most decisions on government expenditure and on taxation are ultimately taken on a UK basis, this is a UK general election and, despite the fact that this Green Party covers only England and Wales, and to maintain consistency and comparability, the policies in this Manifesto will cover the whole of the UK unless otherwise stated.",NA,NA
"EXECUTIVE SUMMARY","H",NA
"To tackle the Climate Emergency,","501",NA
"and deliver social justice, we propose:","503",NA
"The Green New Deal",NA,NA
"The Green New Deal will invest in our shared future, funding improvements in:","416.2",NA
"Energy: including the replacement of fossil fuels with renewable energy.","416.2",NA
"Housing: including the provision of better insulation for all homes that need it,","501",NA
"the delivery of major heating upgrades for 1 million homes a year","501",NA
"and the creation of 100,000 new energy efficient council homes a year.","504",NA
"Transport: including the delivery of a public and sustainable transport revolution, which will allow people to travel cheaply and safely on new trains, buses, cycleways and footpaths.","411",NA
"Industry: including support for businesses to decarbonise","416.2",NA
"and the provision of training to give people skills","411",NA
"to access millions of new green jobs.","701",NA
"Food, Farming & Forestry: including the planting of 700 million trees","703.1",NA
"and support for healthy and sustainable food and farming systems.","703.1",NA
"Incomes: including the creation of a Universal Basic Income, paid to all UK residents","504",NA
"to tackle poverty and give financial security to everyone.","503",NA
"New green homes, new green transport and new green jobs will get us on track to reduce the UK’s carbon emissions to net zero by 2030","501",NA
"and provide new opportunities for everyone to live happier and more secure lives.","503",NA
"This will be a combined investment of over £100 billion a year in the Green New Deal,","402",NA
"with an additional investment in Universal Basic Income.","412",NA
"To help deliver the Green New Deal, we will deliver four further programmes of reform, closely integrated with our Green New Deal proposals:","501",NA
"Remain and Transform","H",NA
"A People’s Vote to decide the way forward on Brexit,","202.4",NA
"in which the Green Party will campaign for remain.","108",NA
"A commitment to realise the full potential of the European Union","108",NA
"to lead the fight against the Climate Emergency","501",NA
"and to improve the lives of workers,","701",NA
"low income families","503",NA
"and refugees.","201.2",NA
"Grow Democracy","H",NA
"Replacing First Past the Post with a proportional voting system,","204",NA
"giving 16-year-olds the vote,","202.1",NA
"reforming government to better combat the Climate Emergency","501",NA
"and devolving power to councils.","301",NA
"The Green Quality of Life Guarantee","H",NA
"Reversing austerity and funding our public services,","504",NA
"tackling discrimination,","503",NA
"ending the war on drugs,","605.2",NA
"restoring our natural environment","501",NA
"and making wellbeing the focus of our economy.","416.2",NA
"The New Deal for Tax and Spend","H",NA
"Ending wasteful spending on government vanity projects","303",NA
"and reforming our tax system so that the wealthiest pay their fair share.","503",NA
"THE GREEN NEW DEAL","H",NA
"Unleashing a Green Economic and Social Revolution","H",NA
"In 2019, we face a collective challenge greater than we have faced for decades.","606.1",NA
"The climate we all rely on is breaking down.","501",NA
"The impacts are starting to affect us all - the weather is becoming more extreme, wildlife is declining, sea levels are rising.","501",NA
"Our century is only 19 years old, but already we have had 18 of the hottest years on record.","501",NA
"This summer saw the hottest day ever recorded in the UK, and the hottest month ever recorded across the world.","501",NA
"and the hottest month ever recorded across the world.","501",NA
"None of this is happening by accident.","416.2",NA
"It’s the consequence of an out-of¬control economic system that plunders the Earth’s natural resources to create wealth for the few,","416.2",NA
"casting the climate into chaos","416.2",NA
"and causing corrosive levels of inequality.","503",NA
"It’s time for a new start, so we have developed the Green New Deal.","501",NA
"This is a comprehensive ten-year plan ambitious enough to tackle climate and ecological breakdown at the scale and speed set out by science.","501",NA
"It will deliver a fast and fair transformation of our economy and society, renewing almost every aspect of life in the UK:","416.2",NA
"from the way we produce and consume energy,","416.2",NA
"to the way in which we grow the food we eat,","416.2",NA
"and how we work, travel, and heat our homes.","416.2",NA
"As the originators of the Green New Deal, we are the only party you can trust to act in time to tackle the Climate Emergency","501",NA
"and rapidly reduce social and economic inequality","503",NA
"- and to make these our top priorities.","305.1",NA
"The Green New Deal will get the UK on track to reducing climate emissions to net zero by 2030 by:","501",NA
"Meeting most of our energy needs through the domestic production of renewable energy.","416.2",NA
"Reducing our overall energy demand from buildings and homes.","416.2",NA
"Transforming UK industry, transport and land use.","416.2",NA
"There will be a combined investment of over £100 billion a year in the Green New Deal,","402",NA
"with an additional investment in Universal Basic Income.","412",NA
"Through this investment, we will provide new opportunities for everyone to work","701",NA
"and live more sustainably and more securely.","416.2",NA
"The Green New Deal will deliver solid financial foundations across society, through a range of measures including:","416.2",NA
"The creation of millions of new jobs in renewable energy, transport, land management and other sectors","701",NA
"transformed by the transition to a net zero carbon economy.","501",NA
"The provision of the training people need to access these new jobs.","411",NA
"The creation of at least 100,000 new socially rented homes a year through low carbon construction and retrofitting, converting and extending existing buildings.","504",NA
"Implementing the Green New Deal will need to become a fundamental objective of government, nationally and locally, but it will also involve every single one of us: workers and investors, creatives and care workers, scientists and seniors, administrators and accountants, farmers and factory workers, and beyond.","606.1",NA
"Investment will be targeted at those who need it most,","403",NA
"including communities with high unemployment,","701",NA
"those excluded from full participation in the economy","503",NA
"and those dependent on old, energy guzzling, polluting industries.","416.2",NA
"We will work alongside trade unions to ensure a just transition to a green future,","701",NA
"which will leave no one behind.","503",NA
"Business will share collective responsibility for delivering the Green New Deal too and will be incentivised to lead the way by innovating and manufacturing a better future.","402",NA
"Businesses that are currently obliged to maximise returns to shareholders will need to take account of other stakeholders - including the ecosystem - and the impact of their activities on the climate and on communities.","416.2",NA
"Public sector investment to kick-start the Green New Deal will act as a catalyst for private sector investment,","402",NA
"as private investors seek to share in the financial rewards of the transition to a net zero carbon future.","416.2",NA
"The Green New Deal will give power and resources for devolved governments, elected mayors and local governments to transform the communities they represent.","301",NA
"Local people will be directly involved, actively engaging all of us in the future of the places where we live and work.","301",NA
"It will also mean new forms of common ownership throughout vital parts of our infrastructure, such as waterways,","413",NA
"buses,","413",NA
"parks","413",NA
"and railways.","413",NA
"We will create a new public banking infrastructure to help deliver our ambitious programme and the Green New Deal will ensure the banks invest and lend at low, affordable interest rates","403",NA
"to support the economy’s environmental transformation.","416.2",NA
"It will also deliver financial mechanisms and the transfer of new technologies to help the Global South adapt to climate change in a just way.","501",NA
"The Green New Deal will make space for nature, with policies to restore habitats in urban, suburban and countryside settings.","501",NA
"It will transform our food and farming system,","703.1",NA
"to improve human and environmental health,","501",NA
"maximise the landscape’s ability to store carbon and prevent flooding,","501",NA
"promote innovations in land management and ownership,","501",NA
"and ease the transition by protecting jobs and creating new green employment opportunities.","701",NA
"The wider economy will be transformed too, re-purposed to protect and enhance the wellbeing of citizens, society and the natural world.","416.2",NA
"Economic growth will no longer be the way we measure progress.","416.2",NA
"Instead, we will prioritise measures of real prosperity and wellbeing, like improvement in health,","416.2",NA
"reduction of inequality","416.2",NA
"and the restoration and protection of the natural environment on which we all depend.","416.2",NA
"The Green New Deal is also about fairness in a warming world.","501",NA
"Building on the Green Party’s commitment to global justice the Green New Deal includes finance and technology to help the majority world adapt to climate change and support human well-being,","501",NA
"breaking the carbon chains of fossil fuel dependence","416.2",NA
"and ending the economic culture that has viewed people and places primarily for the extraction of profit.","416.2",NA
"In short, the Green New Deal will unleash an urgently needed green economic and social revolution.","501",NA
"There is no time to lose - we must start now.","501",NA
"ELECTED GREENS DELIVERING",NA,NA
"Declaring a Climate Emergency",NA,NA
"In October 2018 the UN’s Intergovernmental Panel on Climate Change published a landmark report warning of the urgent need for rapid and unprecedented change in all aspects of society to cut emissions in half in just 12 years.",NA,NA
"Green councillors in Bristol were the first very politicians in the UK to act in response. Weeks after the publication of the UN Report, Green Cllr Carla Denyer brought an urgent motion to Bristol City Council declaring a Climate Emergency and committing the Council to comprehensive action to make the city carbon neutral by 2030.",NA,NA
"The motion passed - and set off a cascade of others. Over 150 local authorities have now declared their own Climate Emergencies, along with the Scottish Parliament and the National Assembly for Wales. Green councillors and activists are now working to help those declaring emergencies to follow through on their promise of action, delivering radical action to halt the Climate Emergency from the ground up.",NA,NA
"Carla is the Green Party candidate for Bristol West in this General Election.",NA,NA
"In spring 2019 the Green MP for Brighton Pavilion, Caroline Lucas, sponsored an Early Day Motion highlighting the Climate Emergency, and welcomed environmental activist Greta Thunberg to Parliament. A few weeks after Greta addressed MPs on the need for action, Parliament itself declared a Climate Emergency. Caroline continues to work to ensure that warm words from MPs on tackling the Climate Emergency are followed through with meaningful action.",NA,NA
"From council chambers to Westminster, and in hundreds of places in between, Greens are leading the fight against climate chaos.",NA,NA
"This election is your chance to stand with us and put the Climate Emergency at the top of the political agenda.",NA,NA
"The Green New Deal for energy","H",NA
"The key to reducing our impact on the climate is to stop burning fossil fuels as soon as possible.","501",NA
"The UK has an abundance of the wind, tides, sun and rivers needed to be self-sufficient in energy - and it’s time for investment to unleash this potential and enable us leave oil and gas in the ground.","416.2",NA
"The Green New Deal will accelerate the transformation of our energy supply and create the energy infrastructure of the future - one powered by renewables - working in harmony with a reduction in energy demand.","416.2",NA
"With our renewable energy supply unlocked, we can hugely reduce fossil fuel use in our energy system,","416.2",NA
"and with it our reliance on nuclear power.","416.2",NA
"The Green New Deal for energy will revolutionise the way we produce and use energy.","416.2",NA
"It will: Enable communities to develop their own renewable energy projects, so that the benefits of locally generated energy can stay local.","606.1",NA
"Introduce new support and incentives to directly accelerate wind energy development,","402",NA
"paving the way for wind to provide around 70% of the UK’s electricity by 2030.","416.2",NA
"Introduce new support for solar, geothermal, tidal, hydro and other renewable energies to provide much of the remainder of the UK’s energy supply by 2030.","402",NA
"Transform the planning system so that it works to support a massive increase in wind power and other renewable generation.","403",NA
"Work with the Crown Estate, which owns much of the UK’s coastline, to open up more coastal waters for offshore wind and marine energy.","403",NA
"We will ensure that the long-term profits from these vital energy assets come to the UK government rather than energy firms.","412",NA
"Remove subsidies to the oil and gas industries.","416.2",NA
"Apply a Carbon Tax on all fossil fuel imports and domestic extraction, based on greenhouse gas emissions produced when fuel is burnt.","416.2",NA
"We will also apply a Carbon Tax on imported energy, based on its embedded emissions.","416.2",NA
"We will raise the Carbon Tax rate progressively over a decade, rendering coal, oil and gas financially unviable as cheaper renewable energies rise up to take their place.","416.2",NA
"Connect our electricity supply more closely to that of our neighbours in Europe, to provide a wider supply we can call on when needed","416.2",NA
"and to allow us to export electricity when we have a surplus.","416.2",NA
"Subsea connections to Norway and Iceland to connect to their hydro and geothermal power supplies will beparticularly encouraged.","416.2",NA
"Deploy demand side management and significantly expand and improve the efficiency of the electricity grid, doubling its capacity so that it can distribute the increased electricity the UK will need","409",NA
"as it transitions away from fossil fuels.","501",NA
"Expand our short-term capacity for energy storage so that electricity from peak periods of renewable electricity generation (e.g. days with very strong winds and many hours of sunshine) can be effectively stored","416.2",NA
"– utilising solutions such a domestic solar batteries,","416.2",NA
"storage as heat in hot water cylinders and thermal stores,","416.2",NA
"and smart control of vehicle battery charging.","416.2",NA
"Prohibit the construction of nuclear power stations.","416.2",NA
"We know that nuclear is a distraction from developing renewable energy,","416.2",NA
"carries an unacceptable risk for the communities living close to nuclear energy facilities,","416.2",NA
"creates unmanageable quantities of radioactive waste","416.2",NA
"and is inextricably linked with the production of world-destroying nuclear weapons.","416.2",NA
"Encourage greater energy efficiency across the economy,","501",NA
"including by providing energy efficiency training for businesses and public bodies,","411",NA
"emphasising the need for behavioural change - we all need to value energy as we value money.","501",NA
"Small businesses and co-ops will receive this training for free.","403",NA
"Ban fracking, and other unconventional forms of fossil fuel extraction, now and forever.","416.2",NA
"The Green New Deal for housing","H",NA
"Green New Deal investment in housing will simultaneously reduce climate emissions,","501",NA
"tackle fuel poverty","503",NA
"and provide genuinely affordable housing.","503",NA
"We will improve the insulation of every home in the UK, making sure they are all warm in winter.","501",NA
"This green homes revolution will make sure nobody is forced to choose between heating or eating.","503",NA
"Everyone should have a safe, affordable and warm place to call home.","503",NA
"We will end the housing crisis by creating enough affordable homes – including 100,0new council homes a year.","504",NA
"Our plans will also ensure that all new and renovated homes meet the highest possible standards and meet social needs.","503",NA
"Work on our homes, businesses and public buildings will create quality jobs in every part of the UK","701",NA
"as we shift to a net zero carbon economy.","501",NA
"Our Green New Deal for housing will: Empower local authorities to bring empty homes back into use","301",NA
"and create a total of 100,000 new homes for social rent (council homes) a year, built to the Passivhaus or equivalent standard.","504",NA
"This standard will see these new homes use 90% less energy for space heating than the average home, significantly reducing household bills.","501",NA
"Allocate funding to local authorities for council home creation based on the needs of their area.","301",NA
"We expect much of the need to be concentrated in areas where Green New Deal jobs will be created.","701",NA
"We will incentivise local authorities to spread small developments across their areas, rather than building huge new estates,","504",NA
"and to build, renovate and convert to high quality designs that respect local architectural heritage.","504",NA
"The new council homes will offer secure, lifetime tenancies.","504",NA
"Ensure all new developments will be located and designed to ensure that residents do not need cars to live a full life, either having safe pedestrian access to local shops and schools,","501",NA
"or are within 1km of a local rail, tube or tram station,","501",NA
"or 500m of a high frequency bus service.","501",NA
"Make energy efficiency and elimination fuel poverty a national infrastructure priority.","503",NA
"Improve the insulation of every UK home that needs more insulation by 2030.","501",NA
"The material used for these insulation improvements will be sustainable.","501",NA
"Significantly reduce heating bills by improving 1 million existing homes and other buildings a year, so that they reach the highest standard of energy efficiency (over and above the Energy Performance Certificate A rating).","501",NA
"Homes lived in by people on low incomes will be the first to receive these major improvements and benefit from reduced heating bills.","503",NA
"This will be a deep retrofitting of 10 million homes by 2030,","501",NA
"on top of the insulation improvements every home that needs it will receive.","501",NA
"Roll out solar panels and other forms of renewable domestic energy generation, giving 1 million households a year the means to generate a proportion of the energy they use.","501",NA
"This will mean that 10 million homes are able to generate their own renewable energy by 2030.","501",NA
"Reduce the use of natural gas for heating homes through a programme, to replace polluting boilers with renewable heat from heat pumps, and solar thermal, geothermal, biomass and stored heat technologies.","501",NA
"Insulate non domestic buildings, addressing the large amounts of energy lost from offices and public buildings.","501",NA
"Deploy heat networks to transport heat from the source of renewable heat to individual buildings in a district or neighbourhood.","501",NA
"Transform the planning system and building regulations, so that all new buildings built by private developers are built to the Passivhaus standard (or to a standard that delivers energy efficiency at an equivalent or better level).","501",NA
"We will enable self¬build development that meets the same standards.","501",NA
"Improve building regulations so that all renovations to roofs, external walls, windows and doors improve the energy performance of that part of the building to the equivalent of (or better than) an Energy Performance Certificate A rating.","501",NA
"We will reinstate the requirement for local council building control inspectors to carry out inspections themselves of new build properties and renovations to ensure this work is carried out to the required standards.","501",NA
"Ensure that all 8 million rented homes are A rated for energy efficiency, or as close to this as possible, by implementing a Minimum Energy Efficiency Standard escalator to raise the minimum level allowed from the current E rating to A rating by 2030.","403",NA
"Update the fire safety regulations relating to the use of all types of insulation in buildings.","403",NA
"Change the planning system to incentivise renovation, extension and improvement of existing buildings, rather than relying on new build,","402",NA
"to reduce the use of steel, concrete, cladding and finishes, which produce massive amounts of carbon in their manufacture.","501",NA
"Similarly we will incentivise the use of sustainable materials.","501",NA
"These reforms will integrate closely with the proposals set out in the ‘Delivering secure incomes and homes’ section on page 49.","501",NA
"The Green New Deal for transport","H",NA
"Our transport system is built on fossil fuels.","501",NA
"As well as destabilising our climate, this reliance traps us into stressful, unhealthy and expensive forms of travel.","501",NA
"Car dependency contributes to congestion, road danger and air pollution whilst reducing physical activity.","501",NA
"The Green New Deal will revolutionise our transport system by ending dependence on carbon,","411",NA
"and investing instead in alternatives that work for better for the climate and for people.","501",NA
"This means more reliable and affordable trains, electric buses and trams,","411",NA
"and better options for cycling and walking.","501",NA
"From new trains and targeted fare reductions, to rapidly expanding bike hire schemes, we think it’s time to transform the way the UK moves.","501",NA
"Our Green New Deal for transport will invest in public transport, walking and cycling so wherever people live they are not forced to use a car, by:","501",NA
"Spending £2.5 billion a year on new cycleways and footpaths,","411",NA
"built using sustainable materials, such as woodchips and sawdust.","501",NA
"Making travelling by public transport cheaper than travelling by car, by reducing the cost of travelling by train and bus.","501",NA
"Coach travel will also be encouraged, with new routes for electric coaches provided across the country.","411",NA
"Creating a new golden age of train by opening new rail connections that remove bottlenecks,","411",NA
"increase rail freight capacity,","411",NA
"improve journey times and frequencies,","411",NA
"enhance capacity in the South West, Midlands and North,","411",NA
"and connect currently unconnected urban areas.","411",NA
"We would also look, where possible, to re-open closed stations.","411",NA
"These rail improvements will benefit from funding switched from the damaging HS2 scheme, which we will cancel (see ‘Ending wasteful spending’ section below for more details).","416.2",NA
"Electrifying all railway lines that connect cities, improving punctuality.","411",NA
"Creating a government-owned rolling stock company which would invest in a fleet of new electric trains to run on newly electrified lines.","411",NA
