"text","cmp_code","eu_code"
"This new UK Bill of Rights will apply across England, Wales, Scotland and Northern Ireland.","201",NA
"‘INNOCENT UNTIL PROVEN GUILTY’",NA,NA
"UKIP will fully uphold the principle of ‘innocent until proven guilty.’","601",NA
"This tenet of law is fundamental to British justice","601",NA
"and UKIP will reverse the opt-in to EU law and justice measures, which disregard this fundamental principle, including the European Arrest Warrant and European Investigation Orders, which were enacted by the Coalition partners and supported by Labour.","110",NA
"THE UK POLICE",NA,NA
"Austerity cuts have forced cuts to policing numbers that have gone too far, placing citizen safety and trust in policing at severe risk.","605",NA
"UKIP is committed to returning to a meaningful capita population-based policing resource.","605",NA
"Serving officers should not be subjected to undue stress as a result of being over-stretched.","605",NA
"Crime is not a ‘lifestyle option’ UKIP will tolerate.","605",NA
"The more visible police we have on our streets, the more criminals are reminded of this fact and the more the public are reassured.","605",NA
"Reducing the numbers of territorial constabularies nationwide will release finance onto the front line:","605",NA
"we  question whether 43 constabularies, each with a multiplicity and duplication of roles, is either a viable situation  or one suited to delivering operational efficiency.","605",NA
"This will not be a ‘top-down’ process however, but an expert,  police-led approach, leading to collaboration and co-operation between constabularies and policing bodies  with the aim of producing structures more relevant to policing in 21st century Britain.","605",NA
"We will also reduce the number of Police and Crime Commissioners in line with our objective of a reduction in the number of territorial constabularies to save money and tackle serious crime.","605",NA
"The PCC role and remit will be reviewed before the next set of PCC elections to identify ´Best Practice´ that has been achieved across the country.","605",NA
"The findings of this exercise will be used to establish a new Terms of Reference and role specification for the remaining PCCs to ensure that they are ´fit for purpose´ regarding the identified challenges for policing and the criminal justice system as a whole.","605",NA
"We will also: Commit to keeping sworn and warranted officers under the service of the Crown.","605",NA
"UKIP will not outsource or privatise UK policing","605",NA
"Refuse to allow the introduction or deployment of the Euro Gendarmerie force within the UK","110",NA
"Invest in new technology such as communications equipment and personal CCTV to combat crime","605",NA
"Ensure Britain’s police forces comply with the law and do not retain booking photographs, fingerprints, DNA, or biometric data of individuals who have not been convicted of a crime","201",NA
"Seek to match the make-up of the police force to the UK’s population profile","605",NA
"Introduce an accredited system for police recruitment in line with UKIP policy on apprenticeships and vocational training.","605",NA
"CRIME AND SENTENCING",NA,NA
"The nature of crime has changed dramatically.","605",NA
"The Internet, impossible to police completely, is growing as a medium to commission and commit crime.","605",NA
"Up to one third of women report being the victim of domestic violence, yet in itself it is not an offence.","605",NA
"There is confusion concerning laws on carrying potentially lethal weapons.","605",NA
"While we once believed we had abolished slavery, people trafficking is increasing and modern-day slavery is a harsh reality.","605",NA
"UKIP believes it is time for a review of what is and what is not a criminal offence and we will commit to such a review,","605",NA
"together with a review of commensurate sentencing policy to address the changing nature of crime today.","605",NA
"The emphasis of such a review is likely to be on up to date sentencing procedures and processes for internet/cyber crime, sexual crime relating to minors, fraud, aggression, intimidation, people trafficking and gang masters and drug & substance abuse.","605",NA
"Our overall approach to crime is one of firmness, coupled with deterrent and rehabilitative strategies and a focus on combatting crime that delivers clear social value outcomes.","605",NA
"We are also clear that the interests of law-abiding citizens and victims must always take precedence over those of criminals.","605",NA
"We also pledge the following: We will prosecute all cases of adult sexual behaviour with under-age minors.","605",NA
"The age of consent will not be reviewed or changed","603",NA
"We will adopt a zero tolerance approach to cultural practices that are either illegal","605",NA
"or which conflict with British values and customs, including forced marriages, female genital mutilation and ‘so-called’ honour killings.","601",NA
"We will enforce the law and prosecute where necessary","605",NA
"UKIP will seek to introduce new personal weapons legislation to reflect progress made on knife crime and combat the many different kinds of items now used to injure, disfigure or kill","605",NA
"We will not decriminalise illegal drugs, however we will focus on ensuring drug suppliers, not their victims, face the full force of the law","605",NA
"We will update licensing laws in response to calls from local authorities to limit the maximum stake on fixed-odds betting terminals from £100 down to £2, to tackle problem gambling and anti-social behaviour.","605",NA
"We will decriminalise one crime: non-payment of the TV licence fee.","303",NA
"This will become a civil rather than a criminal offence.","303",NA
"We will also review the cost of the licence fee with a view to its reduction.","303",NA
"UK PRISONS",NA,NA
"An early priority for UKIP will be to re-establish prison capacity.","605",NA
"We will not risk allowing sentencing or parole hearings to be influenced by a lack of prison places.","605",NA
"In the first instance, we will free up prison space by removing foreign criminals, of which there were over 10,000 in prisons in England and Wales, according to the last reported figures from the House of Commons Library.","601",NA
"We support purpose-built prison facilities and the upgrade of older prisons, but will not reduce prison place numbers, or force an artificial reduction in prisoner capacity via any means.","605",NA
"If criminals do the crime, they can expect to serve the time.","605",NA
"Rehabilitation and reintegration into society for all prisoners is a UKIP priority, so it is essential that prisoners have sufficient numeracy and literacy skills to re-enter the workplace.","605",NA
"We will introduce a system whereby suitably qualified prisoners will be paid to teach prisoners with a low standard of literacy and numeracy.","605",NA
"Prisoners must sign an education covenant requiring them to complete their studies on release.","605",NA
"Any money earned in prison must first be used to pay any compensation due to victims and thereafter towards further studies.","605",NA
"Prisoners will not be given the vote.","605",NA
"Those who have lost their right to liberty by committing a serious crime should also lose their ability to vote.","605",NA
"Voting is a civic right, not a human right.","605",NA
"DEALING WITH FOREIGN CRIMINALS",NA,NA
"There is significant public concern about the ability of convicted foreign criminals first to gain entry to the UK and subsequently to obtain British citizenship.","601",NA
"UKIP will not allow this to continue.","601",NA
"If they have been convicted of any crime, foreign nationals will potentially forfeit any entitlement to a UK Passport and to unrestricted entry to the country.","601",NA
"We will introduce a fast-track deportation programme to  safeguard our national security and ease overcrowding and  pressure on our prison service.","601",NA
"Foreign prisoners in receipt of  custodial sentences will be returned to their country of origin.","601",NA
"If they choose to launch an appeal, they must do so from their  home country, or the country to which they are deported.","601",NA
"They must also pay their own costs, or their home nation must fund their case.","601",NA
"This policy will benefit the UK tax payer;","601",NA
"is fair to all criminals regardless of origin;","503",NA
"and reinstates UK judicial control.","601",NA
"DNA testing and retention of DNA data results will be reinstated for all convicted foreign criminals.","601",NA
"This, in our view, is a major preventative step towards protecting UK citizens and our front-line security forces.","601",NA
"We will amend the Protection of Freedoms Act 2012 to enable the police to continue to keep samples from foreign suspects who are arrested but not charged in Britain.","601",NA
"British justice is still the best in the world,","601",NA
"but is being corrupted by the EU.","110",NA
"Unelected bureaucrats in Brussels and judges in Strasbourg and Luxembourg, can ignore British fears about crime.","110",NA
"It is time to bring our British legal system back under British control.","601",NA
"POLITICAL REFORM",NA,NA
"“Politics in Britain has become a cartel.","304",NA
"Many MPs only became MPs by working in the office of MPs.","304",NA
"Instead of answering outward to their constituents, too many MPs only answer to other MPs in Westminster.","304",NA
"We need fundamental change to reconnect politics with the public.”","304",NA
"With party whips wielding so much power, Parliament has grown supine and often spineless.","304",NA
"Instead of challenging ministers, too many MPs simply do what their whips tell them.","304",NA
"Parliamentary Questions are planted.","304",NA
"Debates are rigged.","304",NA
"Prime Minister’s Question Time generates a lot of heat, but sheds little light.","304",NA
"UKIP wants far reaching political reform to ensure that government answers properly to Parliament and that Parliament is accountable to the people.","202",NA
"We will introduce: The Citizens’ Initiative:","202",NA
"Every two years we will allow a national referendum on the issues of greatest importance to the British public, gathered via an approved petition, provided the petition has more than two million signatures.","202",NA
"The outcome of these referendums will be included in the Queen’s Speech, therefore allowing the public to directly influence legislation.","202",NA
"We will also pledge to put matters gathering over 100,000 signatures on the Commons’ Order Paper, to make sure they are genuinely debated and voted upon, not simply brushed over, as currently happens","202",NA
"The Right of Recall: UKIP will give voters real power to sack their MP and scrap the bogus Recall measures introduced by the Tory-led Coalition.","202",NA
"Under our proposals, if twenty per cent of an MP’s constituents demand it, within a period of eight weeks, a Recall ballot will be triggered.","202",NA
"We will extend this Right of Recall to all elected politicians, e.g. councillors","202",NA
"An Open Primaries Bill: UKIP will introduce an Open Primaries Bill to enable any political parties that wished to do so to widen their selection process to include every local voter.","204",NA
"Open Primary ballots would help ensure candidates in winnable seats need not be Westminster insiders.","202",NA
"As well as making MPs more accountable to the public, UKIP will make Government answer more directly to Parliament.","202",NA
"We will introduce:  Confirmation hearings:",NA,NA
"These will require Commons Select Committees to vote to approve the appointment of any new minister, senior civil servant or senior diplomat before they get the job.","202",NA
"They will also have the power to veto such appointments.","202",NA
"The same rules will apply to senior appointments to quangos and inspection bodies, such as Ofsted","202",NA
"Expenditure hearings:  Until the 1930s, MPs were able to amend public spending plans.","202",NA
"Since then they can only can only cheer or boo government spending plans, which are presented to them as a fait accompli.","202",NA
"In order to control public spending and reduce taxes over time, UKIP will give the relevant Commons Select Committee the power to veto items of spending, but not increase them.","202",NA
"VOTING REFORM",NA,NA
"In an age of multi-party politics, our current first past the post  Parliamentary election system is unfair and no longer fit for  purpose.","202",NA
"Most MPs are elected by a minority of their voters  and perhaps with as little as 26 per cent of the vote share.","202",NA
"UKIP believes voters should know that every vote counts.","202",NA
"We  want an electoral system where each voter can vote for the  party they really believe in, rather than against one they do  not, for tactical reasons.","202",NA
"UKIP will campaign for a new, proportional voting system that delivers a Parliament truly reflective of the number of votes cast, while retaining a constituency link, so every vote really does count.","202",NA
"We will also: Restrict the entitlement to vote in British general elections to British citizens and, potentially, countries which have reciprocal voting rights for British citizens, such as Ireland","601",NA
"Scrap the failing Electoral Commission and Independent Parliamentary Standards Authority (IPSA) and merge their functions into a new Political Standards Authority under new independent leadership and a cross-party board of governance with voting lay members","202",NA
"Remove postal voting on demand.","303",NA
"We will scrap the existing postal vote register completely and start again from scratch.","303",NA
"Those wishing to have a postal vote must have a valid reason for applying.","303",NA
"We will not allow postal voting on demand.","303",NA
"It is open to fraud on such a scale that election rigging is now a real possibility and perhaps even a probability in some areas.","304",NA
"We cannot allow ‘banana republic’ voting fraud in Britain.","304",NA
"LOCAL GOVERNMENT",NA,NA
"“UKIP will bring back power to the people with common sense, local policies which will make people’s lives easier.","301",NA
"UKIP councillors know who is boss: we only answer to you and we are known for rolling up our sleeves and getting the job done!”","301",NA
"Local authorities have significant power in matters concerning planning and housing, education, local refuse and recycling facilities, parks and leisure facilities, transport, libraries and keeping local people safe.","301",NA
"Too often, elected councillors put party politics ahead of taxpayers when making decisions on these important matters.","301",NA
"UKIP believes councils should exist to serve their communities first and we will put power back where it belongs: in the hands of local people.","301",NA
"We will: -Continue to give UKIP councillors the freedom to vote how they choose.","301",NA
"We believe the community is their ‘boss’ and they will not be ‘whipped’ to bloc vote like councillors in other political parties","301",NA
"Keep Council Tax as low as possible","301",NA
"Oppose excessive development and actively seek to protect our countryside and green spaces","501",NA
"Give local people control over planning, by giving them the final say on major planning decisions, such as out-of-town large-scale supermarket developments, wind turbines, incinerators, solar farms and major housing developments, through the use of binding local referenda","301",NA
"Adopt a zero tolerance approach to anti-social behaviour and crack down on nuisance and noisy neighbours","301",NA
"Make the setting up of a traveller pitch without permission illegal","605",NA
"Reinstate weekly bin collections where local communities have lost them and want them reinstated","301",NA
"Oppose the ‘cabinet’ system of governance, which puts too much power in the hands of too few people and advocate a committee system which brings more openness, transparency and cross-party collaborative working","301",NA
"Seek at all times to give council tax payers best value for money by: Cutting excessive allowances for councillors","301",NA
"Slashing excessive pay deals and golden handshakes for council executives","301",NA
"Limiting the number of highly-paid council employees","301",NA
"Cutting advertising and self-promotion budgets","301",NA
"Building partnerships to reduce costs","301",NA
"Abolishing non-essential jobs and red tape.","301",NA
"UKIP will also undertake a full review of all the many statutory duties national government places on local government, with a view to reducing the burden on councils.","301",NA
"BRITISH CULTURE",NA,NA
"“When did patriotism become something to be discouraged?","601",NA
"It can be a unifying force for good.","601",NA
"There is nothing ‘extreme’ about wanting to celebrate ‘Britishness’ and it is about time we started doing so again.”","601",NA
"UKIP believes in Britain.","601",NA
"We believe Britain can be a strong, proud, independent,  sovereign nation.","601",NA
"We are the envy of the world for our rich history,","601",NA
"our art and our architecture,","601",NA
"our monarchy.","601",NA
"We led the way in the abolition of the slave trade.","601",NA
"Our Industrial Revolution transformed the world.","601",NA
"A plethora of great Britons stream through international history.","601",NA
"Our language is the most widely spoken on the planet.","601",NA
"Britain is a remarkable country and we are a remarkable people.","601",NA
"We have helped shape the modern world.","601",NA
"Britain is more than just a star on someone else’s flag.","601",NA
"The liberal metropolitan elite often tells us patriotism is wrong, that it is something to be discouraged.","601",NA
"We are told we should be ashamed of our past; that we must apologise for it.","601",NA
"Hints are dropped that wanting to celebrate ‘Britishness’ is an act that touches on extremism.","601",NA
"We in UKIP, along with the vast majority of the British people, beg to differ.","601",NA
"We are not afraid to talk about the kind of country we are, have been, and indeed, want to be in the future.","601",NA
"Neither are we afraid to tackle head-on cultural issues of crucial importance.","601",NA
"This clearly distinguishes us from the other parties, who have sought to denigrate our historic values of sovereignty, democracy, independence, patriotism and freedom by handing responsibility for Governance over to the EU.","601",NA
"REINVIGORATING BRITISH CULTURE AND VALUES",NA,NA
"UKIP will promote a unifying British culture, open to anyone who wishes to identify with Britain and British values, regardless of their ethnic or religious background.","601",NA
"This is genuine inclusiveness.","601",NA
"We reject multiculturalism, the doctrine whereby different ethnic and religious groups are encouraged to maintain all aspects of their cultures, instead of integrating into our majority culture, even if some of their values and customs conflict with British ones.","608",NA
"We believe multiculturalism has led to an alarming fragmentation of British society.","608",NA
"UKIP does want people to integrate and,","608",NA
"because we believe in Britain,","601",NA
"we are also committed to promoting the English language as a common ingredient that will bind our society together.","608",NA
"With these aims in mind, UKIP will: End the use of multi-lingual formatting on official documents.","608",NA
"These will be published only in English and, where appropriate, Welsh and Gaelic","608",NA
"Uphold freedom of speech within the law","201",NA
"as a fundamental British value.","601",NA
"We believe all ideas and beliefs should be open to discussion and scrutiny and we will challenge the ‘culture of offence’ as it risks shutting down free speech","201",NA
"Recognise that British values include tolerance of religion.","601",NA
"UKIP is committed to protecting religious freedoms for all believers in the UK, in accordance with Article 18 of the Universal Declaration of Human Rights.","201",NA
"We believe, however, that those faiths and beliefs must exist firmly within a British framework.","601",NA
"We will not condone any faith position which is itself intolerant and refuses to recognise the human rights of others","201",NA
"Uphold the integrity of British law, ensuring it applies to all, equally.","601",NA
"We will not condone parallel or conflicting systems that deny equality under the law","601",NA
"Insist that those attending faith-based tribunals must be informed that they cannot be forced to attend and that the rulings from such hearings may not be legally binding under British law","601",NA
"Review funding for public bodies which promote divisiveness through multiculturalism","608",NA
"Introduce a mandatory reporting requirement for suspected cases of Female Genital Mutilation (FGM) for front-line professionals such as teachers, social services, GPs, nurses and police.","608",NA
"This will be supported by the inclusion of FGM awareness into safeguarding training for teachers, school staff and governors.","608",NA
"TAKING PRIDE IN BRITAIN",NA,NA
"We need to take pride in our country again and claim back our heritage from the ‘chattering classes’ who have denigrated our culture, highlighted our failings as a country, rather than celebrating our successes, and tried to make us ashamed to be British.","601",NA
"UKIP will encourage pride in Britain among our young people, who have become detached from our national cultural heritage.","601",NA
"UKIP supports a chronological understanding of British history and achievements in the National Curriculum, which should place due emphasis on the unique influence Britain has had in shaping the modern world.","601",NA
"UKIP will declare St George’s Day, 23rd April a Bank Holiday in England","601",NA
"and St David’s Day, 1st March, in Wales.","601",NA
"TRADE",NA,NA
"“We do not need to be in political union with the EU in order to trade with the EU.","110",NA
"Britain will continue to trade with the EU after Brexit and to say otherwise is a deliberate deceit on the electors of our country.","110",NA
"Leaving means we can increase our trade reach in the world’s growing markets, on our own, for ourselves, without being shackled to an over-bureaucratic, failing EU market that dilutes our influence and produces little except low economic growth and high unemployment.”","110",NA
"The longer we stay in the European Union, the more we become like ‘little Englanders,’ an isolated, insignificant, offshore province in a country called Europe.","110",NA
"We become less and less like the ‘Great’ Britain we really are.","110",NA
"We are a global trading nation,","601",NA
"a G7 country,","601",NA
"the world’s fifth largest economy.","601",NA
"The UK is the fourth largest exporter of goods worldwide;","601",NA
"the seventh largest manufacturing nation;","601",NA
"a permanent member of the UN Security Council;","601",NA
"a founder-member of the World Bank","601",NA
"and the Commonwealth of Nations;","601",NA
"one of the major players in NATO.","601",NA
"English is the most widely-spoken business language and London the world’s leading international financial centre.","601",NA
"Is it astonishing how many politicians claim we are ‘too small’ to go it alone.","601",NA
"These blinkered doomsayers are not just unpatriotic, they are very, very wrong.","601",NA
"OUT OF THE EU AND INTO THE WORLD",NA,NA
"Prior to joining the EU, Britain struck her own trade deals and traded freely across the globe.","110",NA
"We surrendered our trade negotiating rights when we signed up to what was then the EEC and vacated our seat on the World Trade Organisation (WTO).","110",NA
"Britain has not negotiated a single trade deal since 1975 and, while we remain in the EU, we will never negotiate one again.","110",NA
"UKIP believes we can trade again, very successfully, by re-activating our seat at the WTO, where we can negotiate as a full and independent member.","110",NA
"EU TRADE MYTHS EXPLODED",NA,NA
"We do not have to be members of the EU in order to trade with the EU, or any other country.","110",NA
"More than sixty non-EU countries have trade deals with the EU.","110",NA
"In 2013, the top twenty of these, countries such as Switzerland, Norway, Hong Kong, Canada, Nigeria, Mexico and Australia, together exported goods and services worth €2.593 trillion to EU countries, according to the EU’s own figures, more than our entire economy in the same year.","110",NA
"Moreover, six of the top ten countries that export to the EU do not have a trade agreement with the EU at all: China, Russia, the USA, Japan, India and Brazil.","110",NA
"Being in the EU is no guarantee of greater financial rewards than being out in terms of trade:","110",NA
"non-EU Switzerland, with an economy one-quarter the size of ours, exports four and a half times more to the EU, per capita, than the UK does.","110",NA
"The inconvenient truth for our Europhile political class is that political union offers no advantages to trade, although it may inhibit it.","110",NA
"We export more to the USA – some £40 billion annually – than we do to either France or Germany, our largest EU markets, without having to become the fifty-first American state and without the free movement of people between our nations.","110",NA
"TRADE ON ‘BREXIT,’ BRITISH EXIT FROM THE EU",NA,NA
"Once the UK leaves the EU, we, as a country, regain our ability to take back our vacant seat at the WTO and represent ourselves, negotiating our own trade agreements and advancing our own national trade interests.","110",NA
"A first step would be to broker a bespoke UK-EU trade agreement, which we believe is desirable.","110",NA
"This is what we will seek and without doubt achieve, possibly within a very short period of time.","110",NA
